'id','source','accession','title','description','pmid','pub_title','pub_date','pub_author','tech_acc','tech_name','sample_acc','species','exp_type'
26,'GEO',['GSE47921'],'Human adult white matter progenitor cells are multipotent neuroprogenitors identical to adult hippocampal progenitors',"u'Adult neural progenitor cells (aNPCs) are a potential autologous cell source for cell replacement in neurologic diseases such as Parkinson\u2019s disease or stroke or for cell-based gene therapy for neurometabolic diseases. Easy accessibility, long-term expandability and detailed characterization of NPC properties are important requisites for their future translational/clinical applications. aNPC can be isolated from different regions of the adult human brain including the accessible subcortical white matter (aNPCWM), but systematic studies comparing long-term expanded aNPCWM with aNPC from neurogenic brain regions to check for their NPC characteristics and performance are not available. Freshly isolated cells from subcortical white matter and hippocampus (aNPCHIP) expressed oligodendrocyte progenitor cell (OPC) markers such as A2B5, NG2 and OLIG2 in ~20% of cells but no neural stem cell (NSC) markers such CD133 (Prominin1), NESTIN, SOX2 or PAX6. The EGF receptor (EGFR) protein was expressed in 18% of aNPCWM and 7% of aNPCHIP, but only a small fraction of 1 cell out 694 cells from white matter and only 1 out of 1,331 hippocampal cells were able to generate neurospheres. Studies comparing subcortical aNPCWM with their hippocampal counterparts showed that both NPC types expressed mainly markers of glial origin such as NG2, A2B5 and OLIG2, and the NSC/NPC marker Nestin, but no pericyte markers. Both NPC types were able to produce fully mature neurons, astrocytes and oligodendrocytes in comparable amounts to fetal NSC. Whole transcriptome analyses finally confirmed the strong similarity of aNPCWM with aNPCHIP. Our data show that aNPCWM are multipotent NPC with long-term expandability capacity similar to NPC from hippocampus making them an easily accessible source for possible autologous NPC-based treatment strategies. Isolation and propagation of multipotent NPCs. Adult human hippocampal (hip) and subcortical white matter (wm) tissue was obtained from routine epilepsy surgery procedures following informed consent of the subjects. All procedures were in accordance with the Helsinki convention and approved by the Ethical Committee of the University of Dresden (No. 47032006). All subjects underwent high-resolution magnetic resonance imaging excluding tumors and were screened for the presence of infectious disease. In all cases the neuropathological examinations did not reveal evidences for tumor formation. Gene expression Single-channel oligonucleotide microarray analysis. For the gene expression microarray analysis we used the Affimetrix U133A chips containing 22.215 probe sets representing at least 12.905 individual genes. The whole procedure was performed following the manufacturer\u2019s standard protocol (Affimetrix, Santa Clara, CA). For the data processing, normalization was calculated with the GCRMA (GC content corrected Robust Multi-array Analysis) algorithm.'",[],[],[],[],['GPL96'],['[HG-U133A] Affymetrix Human Genome U133A Array'],"['GSM1162429', 'GSM1162432', 'GSM1162430', 'GSM1162433', 'GSM1162427', 'GSM1162428', 'GSM1162431']",['Homo sapiens'],['Expression profiling by array']
27,'GEO',['GSE82101'],'Expression data from human iPSC-NPC',"""Induced pluripotent stem cell-derived neural progenitor cells (iPSC-NPCs) are a promising source of tailor-made cell therapy for neurological diseases. However, tumorigenicity and immunogenicity are major obstacles to translational use. Here we demonstrate epidural therapeutics of human iPSC-NPC grafts after experimental ischemic stroke to avoid surgical damage and intracerebral teratomas. We found that human iPSC-NPCs co-cultured trans-membranously with rat cortical cells subjected to oxygen-glucose deprivation, compared with human mesenchymal stem cells from bone marrow and umbilical cord Wharton's jelly, superiorly enhanced neural survival and growth as well as mitigated astrogliosis. Using comparative whole-genome microarrays and cytokine arrays, we identified a neurorestorative secretome from iPSC-NPCs and neutralization of the enriched cytokines potently abolished the neuroprotective effects in the iPSC-NPC co-cultures. Moreover, we implanted the human iPSC-NPCs epidurally using fibrin glue over the peri-infarct cortex at 7 days following permanent middle cerebral artery occlusion in adult rats. The cell-treated rats showed significant improvement in their paretic forelimb usage and grip strength from 10 days post-transplantation (dpt) onwards compared to the vehicle-treated rats, accompanied by ameliorated infarct/atrophy volumes, inflammatory infiltration and astrogliosis, as well as augmented angiogenesis, oligodendrocyte precursor cells and white matter integrity. Some iPSC-NPCs migrated into the peri-infarct cortex but poorly survived by 21 dpt. This proof-of-concept study demonstrates that a less invasive yet effective epidural delivery route of human iPSC-NPCs may promote functional remodeling of the peri-infarct brain predominantly through distinct paracrine effects.""",[],[],[],[],['GPL570'],['[HG-U133_Plus_2] Affymetrix Human Genome U133 Plus 2.0 Array'],['GSM2183464'],['Homo sapiens'],['Expression profiling by array']
28,'GEO',['GSE66724'],'Hsp70 protects from stroke in atrial fibrillation patients by preventing thrombosis with no increased bleeding risk',"'Atrial fibrillation (AF) is a major risk factor for cardioembolic stroke. Anticoagulant drugs are effective in preventing AF-related stroke. However, the high frequency of anticoagulant-associated major bleeding is a major concern particularly when antiplatelet treatment is simultaneously administered. Here, microarray analysis in peripheral blood cells in eight patients with AF and stroke and eight AF subjects without stroke identified a stroke related gene expression pattern. HSPA1B, which encodes for heat-shock protein 70 kDa (Hsp70), was the most differentially expressed gene. This gene was downregulated in stroke subjects, a finding confirmed further in an independent AF cohort of 200 individuals. Hsp70 knock-out (KO) mice subjected to different thrombotic challenges developed thrombosis significantly earlier than their wild-type (WT) counterparts. In WT mice, Hsp70 inducers (TRC051384, or tubastatin A) delayed thrombus formation. Remarkably, Hsp70 inducers did not increase the bleeding risk even when aspirin was concomitantly administered. Hsp70 induction was associated with an increased vascular thrombomodulin expression, higher circulating levels of activated protein C (APC) upon thrombotic stimulus and increased protection against endothelial apoptosis. Thus, Hsp70 induction is a novel approach to delay thrombus formation with minimal bleeding risk, being especially promising in situations where there is a major bleeding hazard.'",[26976620],['Hsp70 protects from stroke in atrial fibrillation patients by preventing thrombosis without increased bleeding risk.'],['2016 Jun 1'],"[['Allende M', 'Molina E', 'Guruceaga E', 'Tamayo I', u'Gonz\xe1lez-Porras JR', u'Gonzalez-L\xf3pez TJ', 'Toledo E', 'Rabal O', 'Ugarte A', u'Rold\xe1n V', 'Rivera J', 'Oyarzabal J', 'Montes R', 'Hermida J']]",['GPL570'],['[HG-U133_Plus_2] Affymetrix Human Genome U133 Plus 2.0 Array'],"['GSM1630727', 'GSM1630724', 'GSM1630736', 'GSM1630730', 'GSM1630733', 'GSM1630739', 'GSM1630731', 'GSM1630725', 'GSM1630728', 'GSM1630726', 'GSM1630734', 'GSM1630737', 'GSM1630729', 'GSM1630732', 'GSM1630735', 'GSM1630738']",['Homo sapiens'],['Expression profiling by array']
29,'GEO',['GSE68526'],'Peripheral blood transcriptome profiles from an RNA Pilot Study within the United States Health and Retirement Study (HRS)',"'Individual differences in peripheral blood transcriptomes in older adults as a function of demographic, socio-economic, psychological, and health history characteristics.'",[26246388],"['Loneliness, eudaimonia, and the human conserved transcriptional response to adversity.']",['2015 Dec'],"[['Cole SW', 'Levine ME', 'Arevalo JM', 'Ma J', 'Weir DR', 'Crimmins EM']]",['GPL10904'],['Illumina HumanHT-12 V4.0 expression beadchip (gene symbol)'],"['GSM1674342', 'GSM1674365', 'GSM1674388', 'GSM1674425', 'GSM1674385', 'GSM1674408', 'GSM1674325', 'GSM1674362', 'GSM1674428', 'GSM1674368', 'GSM1674322', 'GSM1674345', 'GSM1674405', 'GSM1674382', 'GSM1674351', 'GSM1674328', 'GSM1674397', 'GSM1674374', 'GSM1674431', 'GSM1674411', 'GSM1674334', 'GSM1674348', 'GSM1674371', 'GSM1674394', 'GSM1674354', 'GSM1674417', 'GSM1674414', 'GSM1674391', 'GSM1674331', 'GSM1674320', 'GSM1674360', 'GSM1674403', 'GSM1674380', 'GSM1674377', 'GSM1674400', 'GSM1674314', 'GSM1674337', 'GSM1674420', 'GSM1674357', 'GSM1674383', 'GSM1674423', 'GSM1674363', 'GSM1674317', 'GSM1674340', 'GSM1674412', 'GSM1674329', 'GSM1674426', 'GSM1674349', 'GSM1674366', 'GSM1674409', 'GSM1674343', 'GSM1674432', 'GSM1674326', 'GSM1674389', 'GSM1674406', 'GSM1674429', 'GSM1674386', 'GSM1674323', 'GSM1674352', 'GSM1674346', 'GSM1674369', 'GSM1674335', 'GSM1674358', 'GSM1674398', 'GSM1674415', 'GSM1674332', 'GSM1674355', 'GSM1674315', 'GSM1674375', 'GSM1674338', 'GSM1674361', 'GSM1674384', 'GSM1674372', 'GSM1674418', 'GSM1674395', 'GSM1674392', 'GSM1674378', 'GSM1674381', 'GSM1674421', 'GSM1674364', 'GSM1674407', 'GSM1674393', 'GSM1674324', 'GSM1674370', 'GSM1674321', 'GSM1674344', 'GSM1674413', 'GSM1674427', 'GSM1674424', 'GSM1674367', 'GSM1674390', 'GSM1674404', 'GSM1674401', 'GSM1674318', 'GSM1674341', 'GSM1674430', 'GSM1674410', 'GSM1674387', 'GSM1674319', 'GSM1674416', 'GSM1674347', 'GSM1674422', 'GSM1674399', 'GSM1674339', 'GSM1674316', 'GSM1674330', 'GSM1674327', 'GSM1674350', 'GSM1674373', 'GSM1674313', 'GSM1674396', 'GSM1674336', 'GSM1674433', 'GSM1674419', 'GSM1674333', 'GSM1674356', 'GSM1674402', 'GSM1674379', 'GSM1674376', 'GSM1674353', 'GSM1674359']",['Homo sapiens'],['Expression profiling by array']
30,'GEO',"['GSE71216', 'SRP061426']",'Transcriptome sequencing to identify transcription factor regulatory network and alternative splicing in endothelial cells under VEGF stimulation','Human umbilical vein vascular endothelial cells (HUVECs) are crucial for angiogenesis that benefits functional recovery after cerebral infarction. This study aims to investigate the mechanisms underlying the effects of vascular endothelial growth factor (VEGF) on HUVECs.',[26395122],['Transcriptome Sequencing to Identify Transcription Factor Regulatory Network and Alternative Splicing in Endothelial Cells Under VEGF Stimulation.'],['2016 Feb'],"[['Liu F', 'Gao X', 'Wang J', 'Gao C', 'Li X', 'Li X', 'Gong X', 'Zeng X']]",['GPL16791'],['Illumina HiSeq 2500 (Homo sapiens)'],"[('GSM1830134', 'SRX1115726'), ('GSM1830137', 'SRX1115729'), ('GSM1830135', 'SRX1115727'), ('GSM1830136', 'SRX1115728')]",['Homo sapiens'],['Expression profiling by high throughput sequencing']
31,'GEO',['GSE72642'],"'Genomic profiles for human peripheral blood T cells, B cells, natural killer cells, monocytes, and polymorphonuclear cells: comparisons to ischemic stroke, migraine, and Tourette syndrome'","'Blood genomic profiling has been applied to disorders of the blood and various organ systems including brain to elucidate disease mechanisms and identify surrogate disease markers. Since most studies have not examined specific cell types, we performed a preliminary genomic survey of major blood cell types from normal individuals using microarrays. CD4+ T cells, CD8+ T cells, CD19+ B cells, CD56+ natural killer cells, and CD14+ monocytes were negatively selected using the RosetteSep antibody cocktail, while polymorphonuclear leukocytes were separated with density gradient media. Genes differentially expressed by each cell type were identified. To demonstrate the potential use of such cell subtype-specific genomic expression data, a number of the major genes previously reported to be regulated in ischemic stroke, migraine, and Tourette syndrome are shown to be associated with distinct cell populations in blood. These specific gene expression, cell-type-related profiles will need to be confirmed in larger data sets and could be used to study these and many other neurological diseases.'",[16546348],"['Genomic profiles for human peripheral blood T cells, B cells, natural killer cells, monocytes, and polymorphonuclear cells: comparisons to ischemic stroke, migraine, and Tourette syndrome.']",['2006 Jun'],"[['Du X', 'Tang Y', 'Xu H', 'Lit L', 'Walker W', 'Ashwood P', 'Gregg JP', 'Sharp FR']]",['GPL570'],['[HG-U133_Plus_2] Affymetrix Human Genome U133 Plus 2.0 Array'],"['GSM1867067', 'GSM1867070', 'GSM1867073', 'GSM1867076', 'GSM1867079', 'GSM1867082', 'GSM1867065', 'GSM1867068', 'GSM1867071', 'GSM1867077', 'GSM1867074', 'GSM1867080', 'GSM1867066', 'GSM1867069', 'GSM1867072', 'GSM1867075', 'GSM1867078', 'GSM1867081']",['Homo sapiens'],['Expression profiling by array']
32,'GEO',"['GSE61390', 'SRP047082']",'Genetic Correction and Metabolic Rescue of Pluripotent Cells from Patients with mtDNA',"'Mitochondria are vital due to their principal role in energy production via oxidative phosphorylation (OXPHOS)1. Mitochondria carry their own genome (mtDNA) encoding critical genes involved in OXPHOS, therefore, mtDNA mutations cause fatal or severely debilitating disorders with limited treatment options. 2. Clinical manifestations of mtDNA disease vary based on mutation type and heteroplasmy levels i.e. presence of mutant and normal mtDNA within each cell. 3,4. We evaluated therapeutic concepts of generating genetically corrected pluripotent stem cells for patients with mtDNA mutations. We initially generated multiple iPS cell lines from a patient with mitochondrial encephalomyopathy and stroke-like episodes (MELAS) caused by a heteroplasmic 3243A>G mutation and a patient with Leigh disease carrying a homoplasmic 8993T>G mutation (Leigh-iPS). Due to spontaneous mtDNA segregation in proliferating fibroblasts, isogenic MELAS iPS cell lines were recovered containing exclusively wild type (wt) mtDNA with normal metabolic function. As expected, all iPS cells from the patient with Leigh disease were affected. Using somatic cell nuclear transfer (SCNT; Leigh-NT1), we then simultaneously replaced mutated mtDNA and generated pluripotent stem cells from the Leigh patient fibroblasts. In addition to reversing to a normal 8993G>T, oocyte derived donor mtDNA (human haplotype D4a) in Leigh-NT1 differed from the original haplotype (F1a) at a additional 47 nucleotide sites. Leigh-NT1 cells displayed normal metabolic function compared to impaired oxygen consumption and ATP production in Leigh-iPS cells or parental fibroblasts (Leigh-fib). We conclude that natural segregation of heteroplasmic mtDNA allows the generation of iPS cells with exclusively wild type mtDNA. Moreover, SCNT offers mitochondrial gene replacement strategy for patients with homoplasmic mtDNA disease.'",[26176921],['Metabolic rescue in pluripotent cells from patients with mtDNA disease.'],['2015 Aug 13'],"[['Ma H', 'Folmes CD', 'Wu J', 'Morey R', 'Mora-Castilla S', 'Ocampo A', 'Ma L', 'Poulton J', 'Wang X', 'Ahmed R', 'Kang E', 'Lee Y', 'Hayama T', 'Li Y', 'Van Dyken C', 'Gutierrez NM', 'Tippner-Hedges R', 'Koski A', 'Mitalipov N', 'Amato P', 'Wolf DP', 'Huang T', 'Terzic A', 'Laurent LC', 'Izpisua Belmonte JC', 'Mitalipov S']]","['GPL11154', 'GPL16791']","['Illumina HiSeq 2000 (Homo sapiens)', 'Illumina HiSeq 2500 (Homo sapiens)']","[('GSM1503694', 'SRX700353'), ('GSM1503697', 'SRX700356'), ('GSM1608065', 'SRX874252'), ('GSM1608019', 'SRX873946'), ('GSM1503677', 'SRX700336'), ('GSM1503680', 'SRX700339'), ('GSM1608008', 'SRX873935'), ('GSM1503683', 'SRX700342'), ('GSM1503686', 'SRX700345'), ('GSM1608007', 'SRX873934'), ('GSM1608005', 'SRX873932'), ('GSM1503699', 'SRX700358'), ('GSM1503679', 'SRX700338'), ('GSM1608064', 'SRX874251'), ('GSM1503682', 'SRX700341'), ('GSM1503685', 'SRX700344'), ('GSM1503688', 'SRX700347'), ('GSM1608016', 'SRX873943'), ('GSM1608013', 'SRX873940'), ('GSM1608010', 'SRX873937'), ('GSM1503691', 'SRX700350'), ('GSM1503684', 'SRX700343'), ('GSM1503687', 'SRX700346'), ('GSM1608012', 'SRX873939'), ('GSM1608009', 'SRX873936'), ('GSM1608006', 'SRX873933'), ('GSM1503690', 'SRX700349'), ('GSM1608011', 'SRX873938'), ('GSM1503693', 'SRX700352'), ('GSM1503696', 'SRX700355'), ('GSM1608017', 'SRX873944'), ('GSM1608018', 'SRX873945'), ('GSM1608014', 'SRX873941'), ('GSM1608015', 'SRX873942'), ('GSM1503689', 'SRX700348'), ('GSM1608020', 'SRX873947'), ('GSM1503698', 'SRX700357'), ('GSM1503678', 'SRX700337'), ('GSM1503692', 'SRX700351'), ('GSM1503695', 'SRX700354'), ('GSM1503681', 'SRX700340'), ('GSM1608066', 'SRX874253'), ('GSM1608063', 'SRX874250')]",['Homo sapiens'],"['Expression profiling by high throughput sequencing', 'Third-party reanalysis']"
33,'GEO',['GSE37587'],'Gene Expression Profiling of Ischemic Stroke at 0-24 hours and 24-48 hours after known onset of symptoms','The objective of this study was to provide insight to the molecular mechanisms chaging in the peripheral blood after acute ischemic cerebrovascular syndrome.',[25124890],['A genomic profile of the immune response to stroke with implications for stroke recovery.'],['2015 May'],"[['Barr TL', 'VanGilder R', 'Rellick S', 'Brooks SD', 'Doll DN', 'Lucke-Wold AN', 'Chen D', 'Denvir J', 'Warach S', 'Singleton A', 'Matarin M']]",['GPL6883'],['Illumina HumanRef-8 v3.0 expression beadchip'],"['GSM922909', 'GSM922946', 'GSM922923', 'GSM922943', 'GSM922929', 'GSM922906', 'GSM922926', 'GSM922903', 'GSM922949', 'GSM922895', 'GSM922892', 'GSM922932', 'GSM922915', 'GSM922889', 'GSM922912', 'GSM922952', 'GSM922918', 'GSM922941', 'GSM922935', 'GSM922938', 'GSM922924', 'GSM922921', 'GSM922944', 'GSM922901', 'GSM922927', 'GSM922950', 'GSM922898', 'GSM922904', 'GSM922890', 'GSM922947', 'GSM922953', 'GSM922887', 'GSM922910', 'GSM922930', 'GSM922907', 'GSM922896', 'GSM922913', 'GSM922936', 'GSM922919', 'GSM922893', 'GSM922899', 'GSM922922', 'GSM922905', 'GSM922933', 'GSM922939', 'GSM922916', 'GSM922902', 'GSM922925', 'GSM922945', 'GSM922931', 'GSM922908', 'GSM922954', 'GSM922942', 'GSM922928', 'GSM922951', 'GSM922911', 'GSM922934', 'GSM922948', 'GSM922914', 'GSM922891', 'GSM922940', 'GSM922937', 'GSM922888', 'GSM922917', 'GSM922894', 'GSM922900', 'GSM922897', 'GSM922920']",['Homo sapiens'],['Expression profiling by array']
34,'GEO',['GSE58294'],'Gene Expression Following Cardioembolic Stroke',"'Blood from subjects with cardioembolic stroke and controls was collected, and the RNA extracted was interrogated and whole genome U133 Affymetrix Arrays. Twenty-three control samples and sixty-nine cardioembolic stroke samples were assayed.'",[25036109],['Gene expression in peripheral immune cells following cardioembolic stroke is sexually dimorphic.'],['2014'],"[['Stamova B', 'Jickling GC', 'Ander BP', 'Zhan X', 'Liu D', 'Turner R', 'Ho C', 'Khoury JC', 'Bushnell C', 'Pancioli A', 'Jauch EC', 'Broderick JP', 'Sharp FR']]",['GPL570'],['[HG-U133_Plus_2] Affymetrix Human Genome U133 Plus 2.0 Array'],"['GSM1406036', 'GSM1406096', 'GSM1406119', 'GSM1406050', 'GSM1406073', 'GSM1406076', 'GSM1406053', 'GSM1406113', 'GSM1406033', 'GSM1406056', 'GSM1406093', 'GSM1406116', 'GSM1406082', 'GSM1406070', 'GSM1406105', 'GSM1406059', 'GSM1406099', 'GSM1406039', 'GSM1406062', 'GSM1406085', 'GSM1406122', 'GSM1406079', 'GSM1406078', 'GSM1406101', 'GSM1406124', 'GSM1406102', 'GSM1406042', 'GSM1406118', 'GSM1406041', 'GSM1406098', 'GSM1406121', 'GSM1406055', 'GSM1406081', 'GSM1406035', 'GSM1406061', 'GSM1406058', 'GSM1406038', 'GSM1406044', 'GSM1406104', 'GSM1406064', 'GSM1406067', 'GSM1406110', 'GSM1406087', 'GSM1406090', 'GSM1406047', 'GSM1406107', 'GSM1406084', 'GSM1406063', 'GSM1406123', 'GSM1406040', 'GSM1406066', 'GSM1406043', 'GSM1406060', 'GSM1406046', 'GSM1406086', 'GSM1406109', 'GSM1406092', 'GSM1406095', 'GSM1406083', 'GSM1406049', 'GSM1406072', 'GSM1406103', 'GSM1406075', 'GSM1406089', 'GSM1406106', 'GSM1406069', 'GSM1406115', 'GSM1406091', 'GSM1406114', 'GSM1406112', 'GSM1406052', 'GSM1406108', 'GSM1406111', 'GSM1406088', 'GSM1406045', 'GSM1406068', 'GSM1406048', 'GSM1406071', 'GSM1406034', 'GSM1406037', 'GSM1406094', 'GSM1406117', 'GSM1406120', 'GSM1406051', 'GSM1406065', 'GSM1406054', 'GSM1406100', 'GSM1406077', 'GSM1406097', 'GSM1406080', 'GSM1406074', 'GSM1406057']",['Homo sapiens'],['Expression profiling by array']
35,'GEO',['GSE48424'],'Severe preeclampsia: new blood circulating biomarkers',"'Background: Preeclampsia (PE) is a placental disease characterized by hypertension and proteinuria in pregnant women, which is associated with a high maternal and infantile morbidity. However, circulating biomarkers able to predict the prognosis of PE are lacking. Methods: Thirty-eight women were included in the study. They consisted of 19 patients with PE (13 with severe PE and 6 women with non-severe PE) and 19 gestational age-matched normal pregnancy controls. We measured coagulation pathway, endothelial responses and microparticle release and circulating gene expression in PE patient groups and normotensive controls. Results: The measurement of markers associated with coagulation pathway, endothelial activation and circulating microparticles enabled to discriminate PE from normal pregnancy but were not sufficient to distinguish severe from non-severe PE. PE patients also exhibited a specific transcriptional program distinct from that of control women and subtle differences were observed between severe and non-severe PE. Functional annotation of the up-modulated signature in PE highlighted two main functions related to ribosome and complement. Importantly, we found that 8 genes were specifically up-modulated in severe preeclampsia. Among these genes, the expression of VSIG4 was significantly increased in patients with severe preeclampsia in comparison with controls and patients with non-severe preeclampsia. Conclusion: Using transcriptional signatures of blood samples, we identified the gene encoding the estrogen receptor as a potential diagnostic marker of severe preeclampsia. In addition, the determination of this gene may improve the prognostic assessment of severe preeclampsia.'",[24349325],['Evaluation of current and new biomarkers in severe preeclampsia: a microarray approach reveals the VSIG4 gene as a potential blood biomarker.'],['2013'],"[['Textoris J', 'Ivorra D', 'Ben Amara A', 'Sabatier F', u'M\xe9nard JP', 'Heckenroth H', 'Bretelle F', 'Mege JL']]",['GPL6480'],['Agilent-014850 Whole Human Genome Microarray 4x44K G4112F (Probe Name version)'],"['GSM1177783', 'GSM1177789', 'GSM1177809', 'GSM1177786', 'GSM1177806', 'GSM1177797', 'GSM1177780', 'GSM1177777', 'GSM1177803', 'GSM1177800', 'GSM1177784', 'GSM1177798', 'GSM1177804', 'GSM1177781', 'GSM1177778', 'GSM1177801', 'GSM1177795', 'GSM1177792', 'GSM1177779', 'GSM1177793', 'GSM1177776', 'GSM1177799', 'GSM1177796', 'GSM1177807', 'GSM1177811', 'GSM1177790', 'GSM1177810', 'GSM1177787', 'GSM1177788', 'GSM1177802', 'GSM1177794', 'GSM1177808', 'GSM1177791', 'GSM1177782', 'GSM1177805', 'GSM1177785']",['Homo sapiens'],['Expression profiling by array']
36,'GEO',"['GSE56267', 'SRP040622']",'The age and genomic integrity of neurons after cortical stroke in humans',"'It has been unclear whether ischemic stroke induces neurogenesis or neuronal DNA-rearrangements in the human neocortex. We show here that neither is the case, using immunohistochemistry, transcriptome-, genome- and ploidy-analyses, and determination of nuclear bomb test-derived 14C-concentration in neuronal DNA. A large proportion of cortical neurons display DNA-fragmentation and DNA-repair short time after stroke, whereas neurons at chronic stages after stroke show DNA-integrity, demonstrating the relevance of an intact genome for survival.'",[24747576],['The age and genomic integrity of neurons after cortical stroke in humans.'],['2014 Jun'],"[['Huttner HB', 'Bergmann O', 'Salehpour M', u'R\xe1cz A', 'Tatarishvili J', 'Lindgren E', 'Csonka T', 'Csiba L', u'Hortob\xe1gyi T', u'M\xe9hes G', 'Englund E', 'Solnestam BW', 'Zdunek S', 'Scharenberg C', u'Str\xf6m L', u'St\xe5hl P', 'Sigurgeirsson B', 'Dahl A', 'Schwab S', 'Possnert G', 'Bernard S', 'Kokaia Z', 'Lindvall O', 'Lundeberg J', u'Fris\xe9n J']]",['GPL11154'],['Illumina HiSeq 2000 (Homo sapiens)'],"[('GSM1357996', 'SRX501846'), ('GSM1357999', 'SRX501849'), ('GSM1358005', 'SRX501855'), ('GSM1358002', 'SRX501852'), ('GSM1358001', 'SRX501851'), ('GSM1357998', 'SRX501848'), ('GSM1358004', 'SRX501854'), ('GSM1358006', 'SRX501856'), ('GSM1357995', 'SRX501845'), ('GSM1358003', 'SRX501853'), ('GSM1357994', 'SRX501844'), ('GSM1358000', 'SRX501850'), ('GSM1357997', 'SRX501847')]",['Homo sapiens'],['Expression profiling by high throughput sequencing']
