'id','source','accession','title','description','pmid','pub_title','pub_date','pub_author','tech_acc','tech_name','sample_acc','species','exp_type'
1,'GEO',"['GSE128908', 'SRP191461']",'Abnormalities of cellular polarity underlie the primary substrate in a genetic form of atrial fibrillation',"'Atrial fibrillation (AF) is the most common clinical arrhythmia and is associated with heart failure and stroke. The primary substrate for AF is poorly understood due to limited access to primary human tissue and the lack of mechanistically faithful in vitro or in vivo models. We used an MYH6:mCherry knock-in reporter line to generate and purify human pluripotent stem cell-derived cardiomyocytes displaying electrophysiological and molecular characteristics of atrial cells (hPSC-atrial cells). We modeled human MYL4 mutants, one of the few definitive genetic causes of AF. Single cell transcriptomics on hPSC-atrial cells (WT and MYL4 mutant) was performed to study changes in gene expression among the cell types that exist in atrial lineage.'",[],[],[],[],['GPL18573'],['Illumina NextSeq 500 (Homo sapiens)'],"[('GSM3688218', 'SRX5654571'), ('GSM3688217', 'SRX5654570')]",['Homo sapiens'],['Expression profiling by high throughput sequencing']
2,'GEO',['GSE133347'],u'Distinct Expression Profiles of long non-coding RNAs and messenger RNAs in circulating leukocytes of Parkinson\u2019s disease',"""The molecular mechanism underlying Parkinson's disease (PD), an increasingly common neurodegenerative disease, remains unclear. Long non-coding RNA (lncRNA) plays essential roles in gene expression and human disease. We hypothesize that lncRNAs are involved in the pathogenesis of PD. We profiled the expression of lncRNA in circulating leukocytes of 5 PD patients and 5 healthy controls using microarray.""",[],[],[],[],['GPL21047'],['Agilent-074348 Human LncRNA v6 4X180K [Probe Name Version]'],"['GSM3906074', 'GSM3906071', 'GSM3906077', 'GSM3906069', 'GSM3906078', 'GSM3906075', 'GSM3906072', 'GSM3906073', 'GSM3906070', 'GSM3906076']",['Homo sapiens'],"['Expression profiling by array', 'Non-coding RNA profiling by array']"
3,'GEO',"['GSE140275', 'SRP229618']",'Expression profile and potential functions of circulating long noncoding RNAs in acute ischemic stroke in the Southern Chinese Han population',"'Background: Long noncoding RNAs (lncRNAs) have been confirmed to be associated with ischemic stroke (IS); however, their involvement still needs to be extensively explored. Therefore, we aimed to study the expression profile of lncRNAs and the potential roles and mechanisms of lncRNAs in the pathogenesis of acute ischemic stroke (AIS) in the Southern Chinese Han population. Methods: lncRNA and mRNA expression profiles in AIS were analyzed using high-throughput RNA sequencing (RNA-Seq) and validated using quantitative real-time polymerase chain reaction (qRT-PCR). Gene Ontology (GO), Kyoto Encyclopedia of Genes and Genomes (KEGG) pathway enrichment and network analyses were performed to predict the functions and interactions of the aberrantly expressed genes. Receiver operating characteristic (ROC) curve analysis was performed to evaluate the diagnostic value of lncRNAs in AIS. Results: RNA-Seq analysis showed that 428 lncRNAs and 957 mRNAs were significantly upregulated, while 791 lncRNAs and 4263 mRNAs were downregulated in patients with AIS when compared with healthy controls. GO enrichment and KEGG pathway analyses of differentially expressed genes showed that the apoptosis, inflammatory, oxidative and calcium signaling pathways were potentially implicated in AIS pathology. The PCR results showed that the selected lncRNA-C14orf64 and lncRNA-AC136007.2 were significantly downregulated in AIS. ROC curve analysis showed that the area under the ROC curve (AUC) values of lncRNA-C14orf64 and lncRNA-AC136007.2 between AIS and healthy controls were 0.74 and 0.94, respectively. Conclusion: This study provides evidence of altered expression of lncRNAs and their potential functions in AIS. Our findings may facilitate pathological mechanistic studies of lncRNAs in AIS and provide potential diagnostic biomarkers and therapeutic targets for AIS.'",[31849604],['Expression Profile and Potential Functions of Circulating Long Noncoding RNAs in Acute Ischemic Stroke in the Southern Chinese Han Population.'],['2019'],"[['Li S', 'Zheng H', 'Chen L', 'Xu C', 'Qu X', 'Qin Z', 'Gao J', 'Li J', 'Liu J']]",['GPL16791'],['Illumina HiSeq 2500 (Homo sapiens)'],"[('GSM4158685', 'SRX7131021'), ('GSM4158688', 'SRX7131024'), ('GSM4158686', 'SRX7131022'), ('GSM4158689', 'SRX7131025'), ('GSM4158690', 'SRX7131026'), ('GSM4158687', 'SRX7131023')]",['Homo sapiens'],['Expression profiling by high throughput sequencing']
4,'GEO',"['GSE127478', 'SRP187084']",u'Mitochondrial 3243A\u2009>\u2009G mutation confers pro-atherogenic and pro-inflammatory properties in MELAS iPS derived endothelial cells',"'We obtained three independent sets of endothelial cells differentiated from iPSCs derived from a Mitochondrial encephalomyopathy, lactic acidosis, and stroke-like episodes (MELAS) patient as well as iPSCs that has been corrected for the mitochondrial mutation.'",[31641105],[u'Mitochondrial 3243A\u2009&gt;\u2009G mutation confers pro-atherogenic and pro-inflammatory properties in MELAS iPS derived endothelial cells.'],['2019 Oct 22'],"[['Pek NMQ', 'Phua QH', 'Ho BX', 'Pang JKS', 'Hor JH', 'An O', 'Yang HH', 'Yu Y', 'Fan Y', 'Ng SY', 'Soh BS']]",['GPL20301'],['Illumina HiSeq 4000 (Homo sapiens)'],"[('GSM3635396', 'SRX5444284'), ('GSM3635393', 'SRX5444281'), ('GSM3635392', 'SRX5444280'), ('GSM3635395', 'SRX5444283'), ('GSM3635394', 'SRX5444282'), ('GSM3635391', 'SRX5444279')]",['Homo sapiens'],['Expression profiling by high throughput sequencing']
5,'GEO',['GSE124026'],'Expression data from stroke patients blood samples',"'Ischemic stroke can be classified depending on its etiology as cardioembolic (CE), large-vessel atheroesclerotic (LAA), lacunar, other or cryptogenic. Our aim was to identify gene expression changes that could differentiate CE and LAA stroke in order to guide the optimal secondary treatment .'",[],[],[],[],['GPL5175'],['[HuEx-1_0-st] Affymetrix Human Exon 1.0 ST Array [transcript (gene) version]'],"['GSM3518972', 'GSM3518978', 'GSM3518975', 'GSM3518974', 'GSM3518971', 'GSM3518977', 'GSM3518980', 'GSM3518979', 'GSM3518976', 'GSM3518981', 'GSM3518973']",['Homo sapiens'],['Expression profiling by array']
6,'GEO',"['GSE129935', 'SRP192825']",'RNA sequencing human monocytes',"'Aim: To improve risk stratification in patients with stable coronary artery disease (CAD), we aimed to identify genes in monocytes predictive of new ischemic events in patients with CAD and determine to what extent expression of these transcripts resembles expression in acute myocardial infarction (AMI). Results: COX10 and ZNF484 distinguished between AMI and the whole group of stable CAD patients with an accuracy of 90%. COX10 and ZNF484 together with MT-COI and WNK1 distinguished AMI patients from stable CAD patients with and without a new event with a sensitivity of 89% and a specificity of 98%. MT-COI and COX10 increased the accuracy for separating stable CAD patients with and without a new coronary event from 68 to 80% in addition to age, gender, BMI, diabetes, lipids, blood pressure and hs-CRP. Interestingly, expression of MT-COI, COX10 and WNK1 (but not ZNF484) in PBMCs paired with that in monocytes; COX10 in whole blood was similar to that in monocytes. Conclusions: This work showed that COX10 and ZNF484, eventually combined with MT-COI and WNK1 have the potential to accurately discriminate between AMI and stable CAD patients, and may improve the risk assessment of stable CAD patients.'",[31821324],"['RNA-sequencing reveals that STRN, ZNF484 and WNK1 add to the value of mitochondrial MT-COI and COX10 as markers of unstable coronary artery disease.']",['2019'],"[['Holvoet P', 'Klocke B', 'Vanhaverbeke M', 'Menten R', 'Sinnaeve P', 'Raitoharju E', u'Lehtim\xe4ki T', 'Oksala N', 'Zinser C', 'Janssens S', 'Sipido K', 'Lyytikainen LP', 'Cagnin S']]",['GPL18573'],['Illumina NextSeq 500 (Homo sapiens)'],"[('GSM3728336', 'SRX5702704'), ('GSM3728313', 'SRX5702681'), ('GSM3728316', 'SRX5702684'), ('GSM3728339', 'SRX5702707'), ('GSM3728333', 'SRX5702701'), ('GSM3728319', 'SRX5702687'), ('GSM3728322', 'SRX5702690'), ('GSM3728345', 'SRX5702713'), ('GSM3728325', 'SRX5702693'), ('GSM3728331', 'SRX5702699'), ('GSM3728342', 'SRX5702710'), ('GSM3728334', 'SRX5702702'), ('GSM3728328', 'SRX5702696'), ('GSM3728314', 'SRX5702682'), ('GSM3728340', 'SRX5702708'), ('GSM3728317', 'SRX5702685'), ('GSM3728337', 'SRX5702705'), ('GSM3728343', 'SRX5702711'), ('GSM3728320', 'SRX5702688'), ('GSM3728346', 'SRX5702714'), ('GSM3728323', 'SRX5702691'), ('GSM3728326', 'SRX5702694'), ('GSM3728329', 'SRX5702697'), ('GSM3728312', 'SRX5702680'), ('GSM3728335', 'SRX5702703'), ('GSM3728315', 'SRX5702683'), ('GSM3728338', 'SRX5702706'), ('GSM3728318', 'SRX5702686'), ('GSM3728341', 'SRX5702709'), ('GSM3728332', 'SRX5702700'), ('GSM3728344', 'SRX5702712'), ('GSM3728321', 'SRX5702689'), ('GSM3728324', 'SRX5702692'), ('GSM3728347', 'SRX5702715'), ('GSM3728327', 'SRX5702695'), ('GSM3728330', 'SRX5702698')]",['Homo sapiens'],['Expression profiling by high throughput sequencing']
7,'GEO',"['GSE120521', 'SRP162681']",'RNA-seq of stable and unstable section of human atherosclerotic plaques',"'Atherosclerosis is a serious and very common condition where plaque builds up inside arteries and that can lead to heart attack or stroke. The development and rupture of the plaque is a complex process, involving the interplay of many cell types and the extracellular environment. We performed RNAseq on stable and unstable regions dissected from fresh human carotid plaques obtained at carotid endarterectomy in symptomatic patients. The dissection of the plaques into stable and unstable regions was based on macroscopic appearance, with unstable regions characterised as the visible zone of plaque rupture.'",[31339449],['The Human-Specific and Smooth Muscle Cell-Enriched LncRNA SMILR Promotes Proliferation by Regulating Mitotic CENPF mRNA and Drives Cell-Cycle Progression Which Can Be Targeted to Limit Vascular Remodeling.'],['2019 Aug 16'],"[['Mahmoud AD', 'Ballantyne MD', 'Miscianinov V', 'Pinel K', 'Hung J', 'Scanlon JP', 'Iyinikkel J', 'Kaczynski J', 'Tavares AS', 'Bradshaw AC', 'Mills NL', 'Newby DE', 'Caporali A', 'Gould GW', 'George SJ', 'Ulitsky I', 'Sluimer JC', 'Rodor J', 'Baker AH']]",['GPL16791'],['Illumina HiSeq 2500 (Homo sapiens)'],"[('GSM3402507', 'SRX4741777'), ('GSM3402504', 'SRX4741774'), ('GSM3402506', 'SRX4741776'), ('GSM3402508', 'SRX4741778'), ('GSM3402509', 'SRX4741779'), ('GSM3402505', 'SRX4741775'), ('GSM3402511', 'SRX4741781'), ('GSM3402510', 'SRX4741780')]",['Homo sapiens'],['Expression profiling by high throughput sequencing']
8,'GEO',['GSE104053'],'AGO CLIP reveals an activated network for acute regulation of brain glutamate homeostasis in ischemic stroke','This SuperSeries is composed of the SubSeries listed below.',[],[],[],[],"['GPL15520', 'GPL17021', 'GPL16417']","['Illumina MiSeq (Homo sapiens)', 'Illumina HiSeq 2500 (Mus musculus)', 'Illumina MiSeq (Mus musculus)']","[('GSM2788083', 'SRX3200402'), ('GSM2788060', 'SRX3200379'), ('GSM2788332', 'SRX3200840'), ('GSM2788037', 'SRX3200356'), ('GSM2788014', 'SRX3200342'), ('GSM2788034', 'SRX3200353'), ('GSM2788020', 'SRX3200348'), ('GSM2788057', 'SRX3200376'), ('GSM2788080', 'SRX3200399'), ('GSM2788329', 'SRX3200837'), ('GSM2788326', 'SRX3200873'), ('GSM2788017', 'SRX3200345'), ('GSM2788040', 'SRX3200359'), ('GSM2788077', 'SRX3200396'), ('GSM2788023', 'SRX3200351'), ('GSM2788046', 'SRX3200365'), ('GSM2788069', 'SRX3200388'), ('GSM2788278', 'SRX3200419'), ('GSM2788066', 'SRX3200385'), ('GSM2788043', 'SRX3200362'), ('GSM2788049', 'SRX3200368'), ('GSM2788275', 'SRX3200416'), ('GSM2788315', 'SRX3200862'), ('GSM2788086', 'SRX3200405'), ('GSM2788063', 'SRX3200382'), ('GSM2788318', 'SRX3200865'), ('GSM2788272', 'SRX3200413'), ('GSM2788075', 'SRX3200394'), ('GSM2788052', 'SRX3200371'), ('GSM2788072', 'SRX3200391'), ('GSM2788015', 'SRX3200343'), ('GSM2788078', 'SRX3200397'), ('GSM2788324', 'SRX3200871'), ('GSM2788055', 'SRX3200374'), ('GSM2788281', 'SRX3200422'), ('GSM2788035', 'SRX3200354'), ('GSM2788012', 'SRX3200340'), ('GSM2788321', 'SRX3200868'), ('GSM2788327', 'SRX3200835'), ('GSM2788273', 'SRX3200414'), ('GSM2788084', 'SRX3200403'), ('GSM2788081', 'SRX3200400'), ('GSM2788021', 'SRX3200349'), ('GSM2788061', 'SRX3200380'), ('GSM2788038', 'SRX3200357'), ('GSM2788319', 'SRX3200866'), ('GSM2788058', 'SRX3200377'), ('GSM2788064', 'SRX3200383'), ('GSM2788024', 'SRX3200352'), ('GSM2788330', 'SRX3200838'), ('GSM2788044', 'SRX3200363'), ('GSM2788041', 'SRX3200360'), ('GSM2788018', 'SRX3200346'), ('GSM2788047', 'SRX3200366'), ('GSM2788070', 'SRX3200389'), ('GSM2788316', 'SRX3200863'), ('GSM2788050', 'SRX3200369'), ('GSM2788322', 'SRX3200869'), ('GSM2788079', 'SRX3200398'), ('GSM2788056', 'SRX3200375'), ('GSM2788039', 'SRX3200358'), ('GSM2788325', 'SRX3200872'), ('GSM2788067', 'SRX3200386'), ('GSM2788087', 'SRX3200406'), ('GSM2788279', 'SRX3200420'), ('GSM2788276', 'SRX3200417'), ('GSM2788328', 'SRX3200836'), ('GSM2788053', 'SRX3200372'), ('GSM2788036', 'SRX3200355'), ('GSM2788282', 'SRX3200423'), ('GSM2788059', 'SRX3200378'), ('GSM2788065', 'SRX3200384'), ('GSM2788274', 'SRX3200415'), ('GSM2788085', 'SRX3200404'), ('GSM2788062', 'SRX3200381'), ('GSM2788016', 'SRX3200344'), ('GSM2788076', 'SRX3200395'), ('GSM2788013', 'SRX3200341'), ('GSM2788019', 'SRX3200347'), ('GSM2788073', 'SRX3200392'), ('GSM2788042', 'SRX3200361'), ('GSM2788082', 'SRX3200401'), ('GSM2788323', 'SRX3200870'), ('GSM2788277', 'SRX3200418'), ('GSM2788320', 'SRX3200867'), ('GSM2788071', 'SRX3200390'), ('GSM2788280', 'SRX3200421'), ('GSM2788068', 'SRX3200387'), ('GSM2788317', 'SRX3200864'), ('GSM2788331', 'SRX3200839'), ('GSM2788045', 'SRX3200364'), ('GSM2788022', 'SRX3200350'), ('GSM2788051', 'SRX3200370'), ('GSM2788074', 'SRX3200393'), ('GSM2788048', 'SRX3200367'), ('GSM2788054', 'SRX3200373')]","['Homo sapiens', 'Mus musculus']","['Expression profiling by high throughput sequencing', 'Third-party reanalysis', 'Non-coding RNA profiling by high throughput sequencing']"
9,'GEO',"['GSE104048', 'SRP118313']",'AGO CLIP reveals an activated network for acute regulation of brain glutamate homeostasis in ischemic stroke [dataset 6]',u'Human motor cortex (brodmann\u2019s area 9) tissues analyzed by Argonaute HITS-CLIP to determine human transcriptome-wide AGO binding pattern.',[],[],[],[],['GPL15520'],['Illumina MiSeq (Homo sapiens)'],"[('GSM2788329', 'SRX3200837'), ('GSM2788332', 'SRX3200840'), ('GSM2788327', 'SRX3200835'), ('GSM2788330', 'SRX3200838'), ('GSM2788328', 'SRX3200836'), ('GSM2788331', 'SRX3200839')]",['Homo sapiens'],['Expression profiling by high throughput sequencing']
10,'GEO',['GSE125771'],'RNA expression data from calcified human carotid atherosclerotic plaques',"'Although unstable atherosclerosis in the carotid bifurcation is a significant etiology behind ischemic stroke, clinical imaging methods to distinguish stable from vulnerable lesions are lacking and selection of patients for stroke-preventive intervention still relies on surrogate variables with moderate predictive power, such as the degree of luminal narrowing. Here we combined clinical and diagnostic imaging information by comuted tomography to select patients with calcified plaques for large scale molecular analysis, in an effort to increase our understanding of the pathophysiology behind carotid plaque instability as related to patient- and plaque- phenotype.'",[31109707],['Correlation of computed tomography with carotid plaque transcriptomes associates calcification with lesion-stabilization.'],['2019 Sep'],"[[u'Karl\xf6f E', 'Seime T', 'Dias N', 'Lengquist M', 'Witasp A', 'Almqvist H', 'Kronqvist M', u'G\xe5din JR', 'Odeberg J', 'Maegdefessel L', 'Stenvinkel P', 'Matic LP', 'Hedin U']]",['GPL17586'],['[HTA-2_0] Affymetrix Human Transcriptome Array 2.0 [transcript (gene) version]'],"['GSM3581731', 'GSM3581708', 'GSM3581728', 'GSM3581714', 'GSM3581711', 'GSM3581734', 'GSM3581717', 'GSM3581740', 'GSM3581737', 'GSM3581743', 'GSM3581720', 'GSM3581736', 'GSM3581716', 'GSM3581713', 'GSM3581733', 'GSM3581719', 'GSM3581739', 'GSM3581745', 'GSM3581722', 'GSM3581742', 'GSM3581721', 'GSM3581725', 'GSM3581718', 'GSM3581744', 'GSM3581724', 'GSM3581730', 'GSM3581741', 'GSM3581727', 'GSM3581707', 'GSM3581738', 'GSM3581710', 'GSM3581726', 'GSM3581709', 'GSM3581723', 'GSM3581706', 'GSM3581729', 'GSM3581715', 'GSM3581735', 'GSM3581712', 'GSM3581732']",['Homo sapiens'],['Expression profiling by array']
11,'GEO',['GSE129091'],'Quantitative variation in m.3243A>G mutation produce discrete changes in energy metabolism',"'Mitochondrial DNA (mtDNA) 3243A>G tRNALeu(UUR) heteroplasmic mutation (m.3243A>G) exhibits clinically heterogeneous phenotypes. While the high mtDNA heteroplasmy exceeding a critical threshold causes mitochondrial encephalomyopathy, lactic acidosis with stroke-like episodes (MELAS) syndrome, the low mtDNA heteroplasmy causes maternally inherited diabetes with or without deafness (MIDD) syndrome. How quantitative differences in mtDNA heteroplasmy produces distinct pathological states has remained elusive. Here we show that despite striking similarities in the energy metabolic gene expression signature, the mitochondrial bioenergetics, biogenesis and fuel catabolic functions are distinct in cells harboring low or high levels of the m.3243A>G mutation compared to wild type cells. We further demonstrate that the low heteroplasmic mutant cells exhibit a coordinate induction of transcriptional regulators of the mitochondrial biogenesis, glucose and fatty acid metabolism pathways that lack in near homoplasmic mutant cells compared to wild type cells. Altogether, these results shed new biological insights on the potential mechanisms by which low mtDNA heteroplasmy may progressively cause diabetes mellitus.'",[30962477],[u'Quantitative Variation in m.3243A\u2009&gt;\u2009G Mutation Produce Discrete Changes in Energy Metabolism.'],['2019 Apr 8'],"[['McMillan RP', 'Stewart S', 'Budnick JA', 'Caswell CC', 'Hulver MW', 'Mukherjee K', 'Srivastava S']]",['GPL570'],['[HG-U133_Plus_2] Affymetrix Human Genome U133 Plus 2.0 Array'],"['GSM3693135', 'GSM3693138', 'GSM3693141', 'GSM3693144', 'GSM3693136', 'GSM3693139', 'GSM3693142', 'GSM3693145', 'GSM3693137', 'GSM3693140', 'GSM3693143', 'GSM3693146']",['Homo sapiens'],['Expression profiling by array']
12,'GEO',['GSE129409'],"'The integrative regulatory network of circRNA, microRNA and mRNA in atrial fibrillation'","u'Atrial fibrillation (AF) is the most common irregular heart rhythm which influence approximately 1\u20132% of the general population. As a potential factor for ischemic stroke, AF could also cause heart failure. The mechanisms behind AF pathogenesis are complex and remains elusive. As a new category of non-coding RNAs (ncRNAs), circular RNAs (circRNAs) have been known as the key of developmental processes, regulation of cell function, pathogenesis of heart diseases and pathological responses which could provide novel sight into the pathogenesis of AF. circRNAs function as modulators of microRNAs in cardiac disease. To investigate the regulatory mechanism of circRNA in atrial fibrillation, especially the complex interactions among circRNA, microRNA and mRNA, we collected the heart tissues from three AF patients and three healthy controls and profiled their circRNA expressions with circRNA Microarray. The differentially expressed circRNAs were identified and the biological functions of their interaction microRNAs and mRNAs were analyzed. Our results provided novel insights of the circRNA roles in atrial fibrillation and proposed highly possible interaction mechanisms among circRNAs, microRNAs and mRNAs.'",[31249590],"['The Integrative Regulatory Network of circRNA, microRNA, and mRNA in Atrial Fibrillation.']",['2019'],"[['Jiang S', 'Guo C', 'Zhang W', 'Che W', 'Zhang J', 'Zhuang S', 'Wang Y', 'Zhang Y', 'Liu B']]",['GPL21825'],['074301 Arraystar Human CircRNA microarray V2'],"['GSM3712568', 'GSM3712566', 'GSM3712569', 'GSM3712570', 'GSM3712567', 'GSM3712565']",['Homo sapiens'],"['Expression profiling by array', 'Non-coding RNA profiling by array']"
13,'GEO',['GSE112882'],'Cerebral Cavernous Malformation Proteins and MEKK3 Coordinately Modulate SMURF1 Abundance to Control RhoA-dependent Endothelial Cell Phenotypic State',"'Cerebral Cavernous Malformations (CCM), caused by loss of CCM1, CCM2 or CCM3 in endothelial cells (ECs), are leaky capillaries causing seizures and stroke. CCM protein loss gives overlapping changes in biomechanical and transcriptional properties of ECs, due to common RhoA-driven alterations in cytoskeletal organization and intracellular signaling. However, EC models of 3-D tube formation show loss of each CCM protein generates distinct morphological defects in tubular structures. Computational modeling, live-cell imaging and RNA sequencing revealed distinct functional roles of CCM1 and CCM3 in regulating EC-EC and EC-matrix interactions. CCM2 has an intermediate phenotype consistent with its interaction with CCM1 and CCM3. In ECs, CCM proteins regulate SMURF1 E3 ligase ubiquitination and degradation of RhoA. Loss of CCM proteins results in loss of SMURF1 and a concomitant increase of MEKK3, a negative regulator of SMURF1 expression. We propose CCM lesions develop because of dysregulated SMURF1 resulting in RhoA and MEKK3 gain-of-function.'",[],[],[],[],['GPL18573'],['Illumina NextSeq 500 (Homo sapiens)'],"['GSM3090406', 'GSM3090426', 'GSM3090403', 'GSM3090423', 'GSM3090420', 'GSM3090417', 'GSM3090414', 'GSM3090401', 'GSM3090421', 'GSM3090418', 'GSM3090429', 'GSM3090415', 'GSM3090412', 'GSM3090409', 'GSM3090416', 'GSM3090410', 'GSM3090424', 'GSM3090413', 'GSM3090407', 'GSM3090427', 'GSM3090404', 'GSM3090411', 'GSM3090408', 'GSM3090405', 'GSM3090428', 'GSM3090425', 'GSM3090402', 'GSM3090422', 'GSM3090419']",['Homo sapiens'],['Expression profiling by high throughput sequencing']
14,'GEO',"['GSE122709', 'SRP169610']",'LncRNA expression profiling of ischemic stroke patients','Our study reveals that ischemic stroke can influence the expression of LncRNAs and mRNAs in the peripheral blood at both the acute and subacute stages',[30774621],['LncRNA Expression Profiling of Ischemic Stroke During the Transition From the Acute to Subacute Stage.'],['2019'],"[['Zhu W', 'Tian L', 'Yue X', 'Liu J', 'Fu Y', 'Yan Y']]",['GPL20795'],['HiSeq X Ten (Homo sapiens)'],"[('GSM3483776', 'SRX5027124'), ('GSM3483773', 'SRX5027121'), ('GSM3483779', 'SRX5027127'), ('GSM3483778', 'SRX5027126'), ('GSM3483767', 'SRX5027115'), ('GSM3483770', 'SRX5027118'), ('GSM3483766', 'SRX5027114'), ('GSM3483772', 'SRX5027120'), ('GSM3483769', 'SRX5027117'), ('GSM3483775', 'SRX5027123'), ('GSM3483771', 'SRX5027119'), ('GSM3483768', 'SRX5027116'), ('GSM3483780', 'SRX5027128'), ('GSM3483777', 'SRX5027125'), ('GSM3483774', 'SRX5027122')]",['Homo sapiens'],"['Expression profiling by high throughput sequencing', 'Non-coding RNA profiling by high throughput sequencing']"
15,'GEO',['GSE109187'],'Gene expression profiling of human brain microvascular pericytes with hypoxia and acidosis stimulation',"u'The objective of the present study is to investigate the effect of a stroke mimic condition on human brain pericytes. Comparative gene expression analysis was performed using cultured human brain microvascular pericytes with 1% oxygen for 24 hours or with acidic condition at pH 6.5 for 24 hours. Gene expression was analyzed using 3D-Gene\xae Human 25k oligonucleotide microarrays and computational gene expression analysis tools. Incubation of cells under these conditions resulted in significant changes in numerous genes related with glycolysis, immune responses, and angiogenesis.'",[],[],[],[],['GPL5639'],['3D-Gene Human Oligo chip 25k'],"['GSM2935068', 'GSM2935071', 'GSM2935069', 'GSM2935070']",['Homo sapiens'],['Expression profiling by array']
