'id','source','accession','title','description','pmid','pub_title','pub_date','pub_author','tech_acc','tech_name','sample_acc','species','exp_type'
43,'GEO',['GSE36487'],'Expression data from human vascular smooth muscle cells exposed to minimally oxidized (mox) LDL',"'Atherosclerosis (AT) is a chronic inflammatory disease characterized by the accumulation of inflammatory cells, lipoproteins and fibrous tissue in the walls of arteries. AT is the primary cause of heart attacks and stroke and the leading cause of death in westernized countries. To date, the pathogenesis of AT is not well-defined. Studies have shown that the dedifferentiation of contractile and quiescent vascular smooth muscle cells (SMC) to the proliferative, migratory and synthetic phenotype in the intima is pivotal for the onset and progression of AT. To further delineate the mechanisms underlying the pathogenesis of AT, we have analyzed the early molecular pathways and networks of SMC phenotype transformation as induced by the presence of minimally-oxidized LDL (moxLDL).'",[],[],[],[],['GPL96'],['[HG-U133A] Affymetrix Human Genome U133A Array'],"['GSM894979', 'GSM894977', 'GSM894978']",['Homo sapiens'],['Expression profiling by array']
44,'GEO',['GSE22255'],'Blood genomic expression profile for ischemic stroke (IS)',"u'Stroke is a \u201cbrain attack\u201d cutting off vital blood, and consequently the nutrients and oxygen vital to the brain cells that control everything we do. Stroke is a complex disease with unclear pathogenesis resulting from environmental and genetic factors. To better understand IS\xb4s etiology, we performed genomic expression profiling of patients and controls.'",[22453632],['TTC7B emerges as a novel risk factor for ischemic stroke through the convergence of several genome-wide approaches.'],['2012 Jun'],"[['Krug T', 'Gabriel JP', 'Taipa R', 'Fonseca BV', 'Domingues-Montanari S', 'Fernandez-Cadenas I', 'Manso H', 'Gouveia LO', 'Sobral J', 'Albergaria I', 'Gaspar G', u'Jim\xe9nez-Conde J', 'Rabionet R', 'Ferro JM', 'Montaner J', 'Vicente AM', 'Silva MR', 'Matos I', 'Lopes G', 'Oliveira SA']]",['GPL570'],['[HG-U133_Plus_2] Affymetrix Human Genome U133 Plus 2.0 Array'],"['GSM554044', 'GSM554027', 'GSM554024', 'GSM554047', 'GSM554038', 'GSM554015', 'GSM554021', 'GSM554035', 'GSM554018', 'GSM554041', 'GSM554039', 'GSM554016', 'GSM554022', 'GSM554019', 'GSM554042', 'GSM554030', 'GSM554053', 'GSM554036', 'GSM554050', 'GSM554033', 'GSM554034', 'GSM554017', 'GSM554014', 'GSM554037', 'GSM554048', 'GSM554052', 'GSM554025', 'GSM554045', 'GSM554031', 'GSM554049', 'GSM554051', 'GSM554028', 'GSM554029', 'GSM554020', 'GSM554043', 'GSM554040', 'GSM554032', 'GSM554046', 'GSM554023', 'GSM554026']",['Homo sapiens'],['Expression profiling by array']
45,'GEO',['GSE27041'],'OXPHOS complex I deficiency leads to transcriptional changes of the Nrf2-Keap1 pathway and selenoproteins.',"'Defective complex I (CI) is the most common type of oxidative phosphorylation (OXPHOS) disease in patients, with an incidence of 1 in 5,000 live births. Complex I deficiency can present in infancy or early adulthood and shows a wide variety of clinical manifestations, including Leigh syndrome, (cardio)myopathy, hypotonia, stroke, ataxia and lactic acidosis. A number of critical processes and factors, like superoxide production, calcium homeostasis, mitochondrial membrane potential and mitochondrial morphology, are known to be involved in clinical CI deficiency, but not all factors are yet known and a complete picture is lacking. Therefore, whole genome gene expression profiling was performed in fibroblasts of CI deficient patients and controls, comparing glycolytic and oxidative conditions. Linear regression and pathway analysis identified a number of key adaptive processes.'",[22033105],['Transcriptional changes in OXPHOS complex I deficiency are related to anti-oxidant pathways and could explain the disturbed calcium homeostasis.'],['2012 Jul'],"[['Voets AM', 'Huigsloot M', 'Lindsey PJ', 'Leenders AM', 'Koopman WJ', 'Willems PH', 'Rodenburg RJ', 'Smeitink JA', 'Smeets HJ']]",['GPL570'],['[HG-U133_Plus_2] Affymetrix Human Genome U133 Plus 2.0 Array'],"['GSM666043', 'GSM666026', 'GSM666029', 'GSM666032', 'GSM666035', 'GSM666025', 'GSM666028', 'GSM666031', 'GSM666034', 'GSM666037', 'GSM666040', 'GSM666033', 'GSM666036', 'GSM666039', 'GSM666038', 'GSM666042', 'GSM666041', 'GSM666024', 'GSM666030', 'GSM666027']",['Homo sapiens'],['Expression profiling by array']
46,'GEO',['GSE29932'],"'To identify specific glycosylated structures on brain endothelial cells that mediate rolling, adhesion, and diapedesis of leukocytes in the brain'","'The blood-brain barrier (BBB) dynamically controls and maintains a precisely balanced brain microenvironment necessary for reliable functioning. It is made up of highly specialized endothelial cells (ECs) in the lining of the vascular wall. These ECs are surrounded by the basal lamina, astrocytic perivascular endfeet, pericytes, microglia and neuronal processes that have been shown to contribute to barrier function1. In essence, the brain endothelium limits both transcellular and paracellular passage of cells and molecules into the central nervous system (CNS). Transcellular passage of hydrophilic molecules is limited due to a low rate of transcytotic vesicles, an extremely low pinocytotic activity, expression of active efflux transporters, and high metabolic activity. Paracellular diffusion of hydrophilic molecules and trafficking of immune cells is restricted by a network of tight junctions (TJs)2-5. Due to these characteristics, the BBB is able to protect the CNS from sudden changes in blood composition and uncontrolled influx of immune cells. In a large number of neuro-inflammatory diseases, an impaired function and an opening of the BBB are observed. In diseases of the CNS like multiple sclerosis or stroke or after brain trauma, the BBB becomes inflamed (mediated by for example reactive oxygen species (ROS) and hypoxia) and its function severely impaired which gives rise to enhanced cellular infiltration, thus contributing to tissue damage and neurological deficits. Due to the specialized nature of brain ECs, transmigration of leukocytes through cerebrovascular endothelium is likely to differ from that in other vascular beds. Generally, the transmigration process is closely controlled by the interaction of leukocytes with the endothelial surface followed by low velocity rolling, arrest, firm adhesion, and finally transmigration. For the diapedesis of immune cells across the cerebral vasculature a re-arrangement of the cytoskeleton and opening of the TJ complexes is required to allow cells to pass into the sub endothelial space. In the initial step of the adhesive cascade leukocytes adhere to the endothelium with low affinity. This adhesion is mediated by several members of the selectin family and their corresponding ligands. Despite the low affinity of these interactions, resulting contact of leukocytes with the endothelium leads to further activation of both cell types and finally transmigration of the leukocytes through the BBB6,7.'",[],[],[],[],['GPL11095'],['[GLYCOv3_Hs] Custom Affymetrix Glyco v3 GeneChip'],"['GSM740984', 'GSM740993', 'GSM740990', 'GSM740987', 'GSM740989', 'GSM740986', 'GSM740992', 'GSM740991', 'GSM740988', 'GSM740985']",['Homo sapiens'],['Expression profiling by array']
47,'GEO',['GSE13353'],'Comparison of gene expression between ruptured and unruptured human intracranial aneurysms',"u'Background and Purpose Aneurysmal subarachnoid hemorrhage, almost always from saccular intracranial aneurysm (sIA), is a devastating form of stroke that affects working age population. Cellular and molecular mechanisms predisposing to the rupture of the sIA wall are largely unknown. Such knowledge would facilitate the design of novel diagnostic tools and therapies for the sIA disease. Methods We compared the whole genome expression profile of eleven ruptured sIA wall samples, resected at a median of 15 hours after rupture, to that of eight unruptured ones. Signaling pathways enriched in the ruptured sIA walls were identified with bioinformatic analyses. Their transcriptional control was predicted in silico by seeking the enrichment of conserved transcription factor binding sites in the promoter regions of differentially expressed genes. Results Overall, 686 genes were significantly upregulated and 740 downregulated in the ruptured sIA walls. Significantly upregulated biological processes included: response to turbulent blood flow; chemotaxis; leukocyte migration; oxidative stress; vascular remodelling; and extracellular matrix degradation. Toll like receptor (TLR) signalling and NF-\u03baB, HIF1A and ETS transcription factor binding sites were significantly enriched among the upregulated genes. Conclusions We identified pathways and candidate genes associated to the rupture of human sIA wall. These results provide a molecular basis analysis (a) to identify rupture-prone sIAs and (b) to prevent their rupture. Novel measures to prevent the rupture of sIA wall may include inhibition of response to turbulent blood flow, leukocyte migration, TLR signalling, or blockade of NF-\u03baB, HIF1A and ETS transcription factors.'",[21336216],"[u'Upregulated signaling pathways in ruptured human saccular intracranial aneurysm wall: an emerging regulative role of Toll-like receptor signaling and nuclear factor-\u03baB, hypoxia-inducible factor-1A, and ETS transcription factors.']",['2011 Jun'],"[['Kurki MI', u'H\xe4kkinen SK', u'Fr\xf6sen J', 'Tulamo R', 'von und zu Fraunberg M', 'Wong G', 'Tromp G', u'Niemel\xe4 M', 'Hernesniemi J', u'J\xe4\xe4skel\xe4inen JE', u'Yl\xe4-Herttuala S']]",['GPL570'],['[HG-U133_Plus_2] Affymetrix Human Genome U133 Plus 2.0 Array'],"['GSM337109', 'GSM337112', 'GSM337103', 'GSM337106', 'GSM337120', 'GSM337104', 'GSM337107', 'GSM337118', 'GSM337115', 'GSM337119', 'GSM337113', 'GSM337102', 'GSM337116', 'GSM337110', 'GSM337117', 'GSM337114', 'GSM337108', 'GSM337111', 'GSM337105']",['Homo sapiens'],['Expression profiling by array']
48,'GEO',['GSE25414'],'Expression data from human blood samples',"'Genetic factors contribute to the development of ischemic stroke but their identity remains largely unknown. We tested the association with ischemic stroke of 210 single nucleotide polymorphisms (SNPs) associated with pathways functionally related to stroke. We observed an association between the rs7956957 SNP in LRP1 and next performed microarrays analysis in healthy individuals to investigate possible associations of LRP genotypes with the expression of other genes. Twelve blood samples were obtained from twelve different healthy subjects carrying different genotypes for the rs7956957 SNP of the LRP1 gene (GG, CG or CC).'",[21311749],['Brain perihematoma genomic profile following spontaneous human intracerebral hemorrhage.'],['2011 Feb 2'],"[['Rosell A', 'Vilalta A', u'Garc\xeda-Berrocoso T', u'Fern\xe1ndez-Cadenas I', 'Domingues-Montanari S', 'Cuadrado E', 'Delgado P', u'Rib\xf3 M', u'Mart\xednez-S\xe1ez E', 'Ortega-Aznar A', 'Montaner J']]",['GPL570'],['[HG-U133_Plus_2] Affymetrix Human Genome U133 Plus 2.0 Array'],"['GSM624036', 'GSM624039', 'GSM624042', 'GSM624035', 'GSM624038', 'GSM624041', 'GSM624044', 'GSM624040', 'GSM624043', 'GSM624037', 'GSM624045', 'GSM624034']",['Homo sapiens'],['Expression profiling by array']
49,'GEO',['GSE24095'],'Human postmortem hippocampus: Major depressive disorder (MDD) vs. Control',"'We examined the genetic profile of postmortem brain (hippocampal) samples; 15 brains from patients diagnosed with MDD were matched to brains from healthy subjects based on gender, race and age. Gene expression profiles in the dentate gyrus and CA1 subregions of the hippocampus were assessed by cDNA hybridization to 48K human HEEBO whole genome microarrays (Microarray, Inc).'","[20953200, 22339950]","['A negative regulator of MAP kinase causes depressive behavior.', 'Altered expression of synapse and glutamate related genes in post-mortem hippocampus of depressed subjects.']","['2010 Nov', '2013 Feb']","[['Duric V', 'Banasr M', 'Licznerski P', 'Schmidt HD', 'Stockmeier CA', 'Simen AA', 'Newton SS', 'Duman RS'], ['Duric V', 'Banasr M', 'Stockmeier CA', 'Simen AA', 'Newton SS', 'Overholser JC', 'Jurjus GJ', 'Dieter L', 'Duman RS']]",['GPL10907'],['Microarrays Inc. Human Genomic 49K MI Ready Array [HEEBO]'],"['GSM593097', 'GSM593094', 'GSM593091', 'GSM593080', 'GSM593103', 'GSM593100', 'GSM593083', 'GSM593079', 'GSM593102', 'GSM593099', 'GSM593088', 'GSM593096', 'GSM593085', 'GSM593108', 'GSM593082', 'GSM593105', 'GSM593107', 'GSM593084', 'GSM593104', 'GSM593081', 'GSM593101', 'GSM593087', 'GSM593093', 'GSM593090', 'GSM593092', 'GSM593098', 'GSM593089', 'GSM593086', 'GSM593095', 'GSM593106']",['Homo sapiens'],['Expression profiling by array']
50,'GEO',['GSE22688'],'Differential endothelial cell gene expression by African Americans versus Caucasian Americans: A possible contribution to health disparity in vascular disease and cancer',"u'Background: African Americans (AA) have increased burdens of cardiovascular disease and cancer compared to Caucasian Americans (CA). This study addresses the possibility that genetic differences affecting the biology of the vascular endothelium could be a factor contributing to this health disparity. Methods: From self-identified, healthy, 20-29 year old AA (n=21) and CA (n=17), we established cultures of blood outgrowth endothelial cells (BOEC) and applied microarray profiling. BOEC have never been exposed to in vivo influences, and their gene expression reflects culture conditions (meticulously controlled) and donor genetics. Analysis used two distinct approaches. Significance Analysis of Microarray, a FDR-based test, identified significant differential expression of single genes. Gene Set Enrichment Analysis examined expression of pre-determined gene sets that survey each of nine biological systems relevant to endothelial cell biology. Results: At the highly stringent threshold of FDR=0, we identified 31 single genes that were differentially expressed, 4 higher and 27 lower in AA. \u201cPSPH\u201d exhibited the greatest fold-change (AA>CA), but this was entirely accounted for by a homolog (PSPHL) hidden within the PSPH probe set. Among other significantly different genes were: for AA>CA, SOS1, AMFR, FGFR3; and for AA<CA, ARVCF, BIN3, EIF4B. Many more (221 transcripts for 204 genes) were differentially expressed at the more customary, less stringent threshold of FDR<.05. Using the biological systems approach, we identified shear response biology as being significantly altered for AA versus CA. It detected an apparent tonic increase of expression (AA>CA) for 46/157 genes within that system. Conclusions: The most significant single gene changes detected for AA involved genes having substantial, known roles in endothelial biology. Biological systems analysis suggested that shear stress response, a critical regulator of endothelial function and vascular homeostasis, may be different between AA and CA. These results potentially have direct implications for the role of endothelial cells in both vascular disease (e.g., hypertension and stroke) and cancer (via angiogenesis). The present findings are consistent with our overarching hypothesis that genetic influences stemming from ancestral continent-of-origin could impact upon endothelial cell biology and thereby contribute to disparity of vascular-related disease burden amongst AA.'",[21223544],['Differential endothelial cell gene expression by African Americans versus Caucasian Americans: a possible contribution to health disparity in vascular disease and cancer.'],['2011 Jan 11'],"[['Wei P', 'Milbauer LC', 'Enenstein J', 'Nguyen J', 'Pan W', 'Hebbel RP']]",['GPL96'],['[HG-U133A] Affymetrix Human Genome U133A Array'],"['GSM562332', 'GSM562312', 'GSM562329', 'GSM562309', 'GSM562326', 'GSM562320', 'GSM562343', 'GSM562306', 'GSM562323', 'GSM562307', 'GSM562327', 'GSM562324', 'GSM562341', 'GSM562318', 'GSM562321', 'GSM562335', 'GSM562338', 'GSM562315', 'GSM562339', 'GSM562322', 'GSM562342', 'GSM562336', 'GSM562313', 'GSM562330', 'GSM562319', 'GSM562333', 'GSM562310', 'GSM562316', 'GSM562340', 'GSM562317', 'GSM562337', 'GSM562314', 'GSM562308', 'GSM562311', 'GSM562334', 'GSM562331', 'GSM562325', 'GSM562328']",['Homo sapiens'],['Expression profiling by array']
51,'GEO',['GSE16561'],'Gene expression analysis of peripheral whole blood RNA following ischemic stroke',"'The purpose of this project was to elucidate gene expression in the peripheral whole blood of acute ischemic stroke patients to identify a panel of genes for the diagnosis of acute ischemic stroke. Peripheral blood samples were collected in Paxgene Blood RNA tubes from stroke patients who were >18 years of age with MRI diagnosed ischemic stroke and controls who were non-stroke neurologically healthy. The results suggest a panel of genes can be used to diagnose ischemic stroke, and provide information about the biological pathways involved in the response to acute ischemic stroke in humans.'","[20837969, 28446746, 29263821]","['Genomic biomarkers and cellular pathways of ischemic stroke by RNA gene expression profiling.', 'Peripheral blood AKAP7 expression as an early marker for lymphocyte-mediated post-stroke blood brain barrier disruption.', 'Machine-learning approach identifies a pattern of gene expression in peripheral blood that can accurately detect ischaemic stroke.']","['2010 Sep 14', '2017 Apr 26', '2016']","[['Barr TL', 'Conley Y', 'Ding J', 'Dillman A', 'Warach S', 'Singleton A', 'Matarin M'], [""O'Connell GC"", 'Treadway MB', 'Petrone AB', 'Tennant CS', 'Lucke-Wold N', 'Chantler PD', 'Barr TL'], [""O'Connell GC"", 'Petrone AB', 'Treadway MB', 'Tennant CS', 'Lucke-Wold N', 'Chantler PD', 'Barr TL']]",['GPL6883'],['Illumina HumanRef-8 v3.0 expression beadchip'],"['GSM416580', 'GSM416557', 'GSM416534', 'GSM416537', 'GSM416574', 'GSM416531', 'GSM416554', 'GSM416577', 'GSM416548', 'GSM416571', 'GSM416528', 'GSM416551', 'GSM416545', 'GSM416588', 'GSM416565', 'GSM416568', 'GSM416589', 'GSM416572', 'GSM416529', 'GSM416532', 'GSM416549', 'GSM416552', 'GSM416569', 'GSM416586', 'GSM416560', 'GSM416583', 'GSM416563', 'GSM416543', 'GSM416566', 'GSM416546', 'GSM416567', 'GSM416590', 'GSM416544', 'GSM416540', 'GSM416547', 'GSM416564', 'GSM416587', 'GSM416584', 'GSM416535', 'GSM416558', 'GSM416538', 'GSM416561', 'GSM416541', 'GSM416575', 'GSM416581', 'GSM416555', 'GSM416579', 'GSM416578', 'GSM416542', 'GSM416585', 'GSM416539', 'GSM416562', 'GSM416576', 'GSM416570', 'GSM416582', 'GSM416573', 'GSM416536', 'GSM416559', 'GSM416530', 'GSM416553', 'GSM416533', 'GSM416556', 'GSM416550']",['Homo sapiens'],['Expression profiling by array']
52,'GEO',['GSE21899'],'Global Gene Expression Profiles in Cultured Skin Fibroblasts Derived from Patients with Gaucher Disease',"'This work presents the discovery of genes that are dysregulated in patients with Type I and Type III Gaucher Disease. It provides insight into the unique pathogenesis of these phenotypes, improved diagnostic accuracy and potential novel therapies for these patients.'",[],[],[],[],['GPL571'],['[HG-U133A_2] Affymetrix Human Genome U133A 2.0 Array'],"['GSM544727', 'GSM544730', 'GSM544738', 'GSM544739', 'GSM544736', 'GSM544733', 'GSM544740', 'GSM544734', 'GSM544737', 'GSM544731', 'GSM544729', 'GSM544728', 'GSM544735', 'GSM544732']",['Homo sapiens'],['Expression profiling by array']
53,'GEO',['GSE18296'],'Gene Expression Profiling of an Immortalized Human Neural Stem Cell Line HB1.F3',"'Neural stem cells (NSC) with self-renewal and multipotent properties serve as an ideal cell source for transplantation to treat spinal cord injury, stroke, and neurodegenerative diseases. To efficiently induce neuronal lineage cells from NSC for neuron replacement therapy, we should clarify the intrinsic genetic programs involved in a time and place-specific regulation of human NSC differentiation. Recently, we established an immortalized human NSC clone HB1.F3 to provide an unlimited NSC source applicable to genetic manipulation for cell-based therapy. To investigate a role of neurogenin 1 (Ngn1), a proneural basic helix-loop-helix (bHLH) transcription factor, in human NSC differentiation, we established a clone derived from F3 stably overexpressing Ngn1. Genome-wide gene expression profiling identified 250 upregulated genes and 338 downregulated genes in Ngn1-overexpressing F3 cells (F3-Ngn1) versus wild-type F3 cells (F3-WT). Notably, leucine-rich repeat-containing G protein-coupled receptor 5 (LGR5), a novel stem cell marker, showed a robust increase in F3-Ngn1.'",[19813087],"['Stable expression of neurogenin 1 induces LGR5, a novel stem cell marker, in an immortalized human neural stem cell line HB1.F3.']",['2010 Apr'],"[['Satoh J', 'Obayashi S', 'Tabunoki H', 'Wakana T', 'Kim SU']]",['GPL6244'],['[HuGene-1_0-st] Affymetrix Human Gene 1.0 ST Array [transcript (gene) version]'],"['GSM456722', 'GSM456725', 'GSM456723', 'GSM456724']",['Homo sapiens'],['Expression profiling by array']
54,'GEO',['GSE9877'],'Genetic Endothelial Systems Biology of Sickle Stroke Risk',"'Genetic differences in endothelial biology could underlie development of phenotypic heterogeneity amongst individuals afflicted with vascular diseases. We obtained BOEC (blood outgrowth endothelial cells) from 20 subjects with sickle cell anemia (age 4-19) shown to be either at-risk (n=11) or not-at-risk (n=9) for ischemic stroke due to, respectively, having or not having occlusive disease at the Circle of Willis (CoW). Gene expression profiling identified no significant single gene differences between the two groups, as expected. However, analysis of Biological Systems Scores, using gene sets that were pre-determined to survey each of nine biological systems, showed that only changes in inflammation signaling are characteristic of the at-risk subjects, as supported by multiple statistical approaches Keywords: disease status analysis'",[18156497],['Genetic endothelial systems biology of sickle stroke risk.'],['2008 Apr 1'],"[['Chang Milbauer L', 'Wei P', 'Enenstein J', 'Jiang A', 'Hillery CA', 'Scott JP', 'Nelson SC', 'Bodempudi V', 'Topper JN', 'Yang RB', 'Hirsch B', 'Pan W', 'Hebbel RP']]",['GPL96'],['[HG-U133A] Affymetrix Human Genome U133A Array'],"['GSM249463', 'GSM249426', 'GSM249466', 'GSM249443', 'GSM249446', 'GSM249469', 'GSM249435', 'GSM249449', 'GSM249429', 'GSM249452', 'GSM249455', 'GSM249432', 'GSM249458', 'GSM249461', 'GSM249438', 'GSM249464', 'GSM249441', 'GSM249467', 'GSM249444', 'GSM249430', 'GSM249470', 'GSM249447', 'GSM249450', 'GSM249427', 'GSM249453', 'GSM249433', 'GSM249425', 'GSM249456', 'GSM249459', 'GSM249436', 'GSM249442', 'GSM249445', 'GSM249454', 'GSM249462', 'GSM249439', 'GSM249448', 'GSM249465', 'GSM249471', 'GSM249451', 'GSM249428', 'GSM249431', 'GSM249457', 'GSM249460', 'GSM249468', 'GSM249440', 'GSM249434', 'GSM249437']",['Homo sapiens'],['Expression profiling by array']
55,'GEO',['GSE9391'],'Gene expression in brain following stroke',"'We have used microarrays to investigate the changes in gene expression at various times after stroke. Our findings reported that gene expression screening can detect known and unknown transcriptional features of stroke. Keywords: time course, disease state analysis'",[17997827],['A microarray study of gene and protein regulation in human and rat brain following middle cerebral artery occlusion.'],['2007 Nov 12'],"[['Mitsios N', 'Saka M', 'Krupinski J', 'Pennucci R', 'Sanfeliu C', 'Wang Q', 'Rubio F', 'Gaffney J', 'Kumar P', 'Kumar S', 'Sullivan M', 'Slevin M']]",['GPL127'],['Atlas Human 1.2 Array (Cat. #7850-1)'],"['GSM239108', 'GSM239105', 'GSM239103', 'GSM239106', 'GSM239107', 'GSM239104']",['Homo sapiens'],['Expression profiling by array']
