'id','source','accession','title','description','pmid','pub_title','pub_date','pub_author','tech_acc','tech_name','sample_acc','species','exp_type'
16,'GEO',"['GSE124500', 'SRP174896']",'Modeling CADASIL vascular pathologies with patient-derived induced pluripotent stem cells',"u'Cerebral autosomal dominant arteriopathy with subcortical infarcts and leukoencephalopathy (CADASIL) is a rare hereditary cerebrovascular disease caused by a NOTCH3 mutation. However, the underlying cellular and molecular mechanisms remain unidentified. Here, we generated non-integrative induced pluripotent stem cells (iPSCs) from fibroblasts from a CADASIL patient harboring a heterozygous NOTCH3 mutation (c.3226C>T, p.R1076C). Vascular smooth muscle cells (VSMCs) differentiated from CADASIL-specific iPSCs showed transcriptional changes and disease-associated cellular dysfunction, including activation of the NF-kB signaling pathway, cytoskeleton disorganization, and excessive cell proliferation. In comparison, these abnormalities were not observed in vascular endothelial cells (VECs) derived from the patient\u2019s iPSCs. Importantly, the abnormal upregulation of NF-kB target genes in CADASIL VSMCs was diminished by a NOTCH pathway inhibitor, providing a potential therapeutic strategy for CADASIL. Overall, using this iPSC-based disease model, our study identified clues for studying the disease mechanisms of CADASIL and developing treatment strategies for this disease.'",[30778920],['Modeling CADASIL vascular pathologies with patient-derived induced pluripotent stem cells.'],['2019 Apr'],"[['Ling C', 'Liu Z', 'Song M', 'Zhang W', 'Wang S', 'Liu X', 'Ma S', 'Sun S', 'Fu L', 'Chu Q', 'Belmonte JCI', 'Wang Z', 'Qu J', 'Yuan Y', 'Liu GH']]",['GPL20795'],['HiSeq X Ten (Homo sapiens)'],"[('GSM3535321', 'SRX5190397'), ('GSM3535324', 'SRX5190400'), ('GSM3535313', 'SRX5190389'), ('GSM3535315', 'SRX5190391'), ('GSM3535318', 'SRX5190394'), ('GSM3535314', 'SRX5190390'), ('GSM3535317', 'SRX5190393'), ('GSM3535320', 'SRX5190396'), ('GSM3535316', 'SRX5190392'), ('GSM3535323', 'SRX5190399'), ('GSM3535319', 'SRX5190395'), ('GSM3535322', 'SRX5190398')]",['Homo sapiens'],['Expression profiling by high throughput sequencing']
17,'GEO',['GSE121868'],'Profiles of Extracellular RNA in Cerebrospinal Fluid and Plasma from Subarachnoid Hemorrhage Patients',"'Brain injury resulting from hemorrhagic stroke is clinically challenging to manage and results in high rates of morbidity and mortality. The pathophysiology of brain damage resulting from aneurysmal subarachnoid hemorrhage (aSAH) is largely unknown, and methods to treat and monitor patients are variable with no meaningful correlations to patient outcome. Prediction of patient risk for serious neurological complications is currently a significant clinical obstacle. An extracellular RNA (exRNA) biomarker to predict onset and severity of brain damage would improve patient outcomes. We sequenced plasma and CSF samples from adult patients with SAH. Samples were collected from post bleed day 1 to day 7. Total exRNA was isolated from each sample. In addition, we prepared a subset of 140 CSF samples, isolating the RNA contained within extracellular vesicles and vesicle-depleted biofluid.'",[],[],[],[],['GPL11154'],['Illumina HiSeq 2000 (Homo sapiens)'],"['GSM3448673', 'GSM3448553', 'GSM3448650', 'GSM3448318', 'GSM3448341', 'GSM3448364', 'GSM3448401', 'GSM3448424', 'GSM3448281', 'GSM3448484', 'GSM3448756', 'GSM3448470', 'GSM3448636', 'GSM3448447', 'GSM3448530', 'GSM3448567', 'GSM3448779', 'GSM3448719', 'GSM3448507', 'GSM3448590', 'GSM3448696', 'GSM3448387', 'GSM3448613', 'GSM3448739', 'GSM3448444', 'GSM3448384', 'GSM3448467', 'GSM3448527', 'GSM3448550', 'GSM3448490', 'GSM3448573', 'GSM3448776', 'GSM3448324', 'GSM3448656', 'GSM3448278', 'GSM3448407', 'GSM3448633', 'GSM3448338', 'GSM3448381', 'GSM3448361', 'GSM3448464', 'GSM3448421', 'GSM3448716', 'GSM3448487', 'GSM3448693', 'GSM3448610', 'GSM3448547', 'GSM3448301', 'GSM3448321', 'GSM3448344', 'GSM3448298', 'GSM3448699', 'GSM3448404', 'GSM3448782', 'GSM3448759', 'GSM3448676', 'GSM3448570', 'GSM3448653', 'GSM3448593', 'GSM3448736', 'GSM3448616', 'GSM3448493', 'GSM3448713', 'GSM3448630', 'GSM3448516', 'GSM3448427', 'GSM3448599', 'GSM3448510', 'GSM3448290', 'GSM3448576', 'GSM3448622', 'GSM3448304', 'GSM3448350', 'GSM3448433', 'GSM3448410', 'GSM3448682', 'GSM3448373', 'GSM3448539', 'GSM3448456', 'GSM3448765', 'GSM3448705', 'GSM3448742', 'GSM3448659', 'GSM3448327', 'GSM3448267', 'GSM3448725', 'GSM3448702', 'GSM3448785', 'GSM3448762', 'GSM3448679', 'GSM3448748', 'GSM3448665', 'GSM3448642', 'GSM3448619', 'GSM3448476', 'GSM3448536', 'GSM3448559', 'GSM3448582', 'GSM3448310', 'GSM3448596', 'GSM3448264', 'GSM3448287', 'GSM3448370', 'GSM3448393', 'GSM3448519', 'GSM3448284', 'GSM3448307', 'GSM3448430', 'GSM3448513', 'GSM3448413', 'GSM3448347', 'GSM3448602', 'GSM3448453', 'GSM3448367', 'GSM3448390', 'GSM3448473', 'GSM3448685', 'GSM3448496', 'GSM3448579', 'GSM3448639', 'GSM3448724', 'GSM3448330', 'GSM3448533', 'GSM3448745', 'GSM3448353', 'GSM3448436', 'GSM3448722', 'GSM3448450', 'GSM3448270', 'GSM3448768', 'GSM3448429', 'GSM3448489', 'GSM3448556', 'GSM3448309', 'GSM3448535', 'GSM3448512', 'GSM3448662', 'GSM3448595', 'GSM3448641', 'GSM3448701', 'GSM3448618', 'GSM3448323', 'GSM3448406', 'GSM3448532', 'GSM3448784', 'GSM3448306', 'GSM3448329', 'GSM3448744', 'GSM3448638', 'GSM3448615', 'GSM3448721', 'GSM3448698', 'GSM3448412', 'GSM3448369', 'GSM3448452', 'GSM3448475', 'GSM3448718', 'GSM3448538', 'GSM3448558', 'GSM3448635', 'GSM3448761', 'GSM3448286', 'GSM3448572', 'GSM3448326', 'GSM3448263', 'GSM3448392', 'GSM3448346', 'GSM3448303', 'GSM3448349', 'GSM3448343', 'GSM3448432', 'GSM3448409', 'GSM3448741', 'GSM3448449', 'GSM3448621', 'GSM3448678', 'GSM3448515', 'GSM3448283', 'GSM3448366', 'GSM3448389', 'GSM3448472', 'GSM3448661', 'GSM3448770', 'GSM3448555', 'GSM3448747', 'GSM3448578', 'GSM3448461', 'GSM3448658', 'GSM3448781', 'GSM3448495', 'GSM3448266', 'GSM3448521', 'GSM3448764', 'GSM3448552', 'GSM3448544', 'GSM3448598', 'GSM3448386', 'GSM3448469', 'GSM3448704', 'GSM3448492', 'GSM3448681', 'GSM3448575', 'GSM3448687', 'GSM3448664', 'GSM3448581', 'GSM3448355', 'GSM3448733', 'GSM3448378', 'GSM3448710', 'GSM3448627', 'GSM3448332', 'GSM3448415', 'GSM3448604', 'GSM3448438', 'GSM3448352', 'GSM3448458', 'GSM3448670', 'GSM3448624', 'GSM3448564', 'GSM3448275', 'GSM3448358', 'GSM3448561', 'GSM3448435', 'GSM3448750', 'GSM3448518', 'GSM3448753', 'GSM3448541', 'GSM3448667', 'GSM3448730', 'GSM3448272', 'GSM3448644', 'GSM3448647', 'GSM3448335', 'GSM3448295', 'GSM3448455', 'GSM3448441', 'GSM3448727', 'GSM3448773', 'GSM3448498', 'GSM3448269', 'GSM3448504', 'GSM3448684', 'GSM3448587', 'GSM3448292', 'GSM3448375', 'GSM3448398', 'GSM3448481', 'GSM3448767', 'GSM3448474', 'GSM3448478', 'GSM3448584', 'GSM3448580', 'GSM3448686', 'GSM3448271', 'GSM3448315', 'GSM3448354', 'GSM3448601', 'GSM3448557', 'GSM3448372', 'GSM3448707', 'GSM3448395', 'GSM3448268', 'GSM3448291', 'GSM3448374', 'GSM3448746', 'GSM3448418', 'GSM3448501', 'GSM3448663', 'GSM3448640', 'GSM3448524', 'GSM3448690', 'GSM3448607', 'GSM3448351', 'GSM3448289', 'GSM3448312', 'GSM3448683', 'GSM3448397', 'GSM3448766', 'GSM3448583', 'GSM3448457', 'GSM3448480', 'GSM3448288', 'GSM3448563', 'GSM3448371', 'GSM3448394', 'GSM3448477', 'GSM3448500', 'GSM3448772', 'GSM3448454', 'GSM3448414', 'GSM3448666', 'GSM3448560', 'GSM3448497', 'GSM3448520', 'GSM3448437', 'GSM3448603', 'GSM3448626', 'GSM3448543', 'GSM3448308', 'GSM3448723', 'GSM3448391', 'GSM3448265', 'GSM3448769', 'GSM3448331', 'GSM3448494', 'GSM3448314', 'GSM3448328', 'GSM3448411', 'GSM3448434', 'GSM3448517', 'GSM3448729', 'GSM3448706', 'GSM3448623', 'GSM3448600', 'GSM3448294', 'GSM3448646', 'GSM3448703', 'GSM3448400', 'GSM3448377', 'GSM3448460', 'GSM3448540', 'GSM3448483', 'GSM3448311', 'GSM3448417', 'GSM3448620', 'GSM3448537', 'GSM3448749', 'GSM3448334', 'GSM3448609', 'GSM3448726', 'GSM3448643', 'GSM3448669', 'GSM3448709', 'GSM3448503', 'GSM3448715', 'GSM3448320', 'GSM3448277', 'GSM3448300', 'GSM3448586', 'GSM3448775', 'GSM3448383', 'GSM3448692', 'GSM3448606', 'GSM3448403', 'GSM3448380', 'GSM3448426', 'GSM3448509', 'GSM3448486', 'GSM3448592', 'GSM3448712', 'GSM3448689', 'GSM3448274', 'GSM3448297', 'GSM3448695', 'GSM3448566', 'GSM3448589', 'GSM3448612', 'GSM3448317', 'GSM3448506', 'GSM3448529', 'GSM3448340', 'GSM3448423', 'GSM3448396', 'GSM3448313', 'GSM3448336', 'GSM3448502', 'GSM3448419', 'GSM3448714', 'GSM3448631', 'GSM3448608', 'GSM3448280', 'GSM3448363', 'GSM3448525', 'GSM3448728', 'GSM3448337', 'GSM3448420', 'GSM3448442', 'GSM3448738', 'GSM3448443', 'GSM3448655', 'GSM3448548', 'GSM3448526', 'GSM3448632', 'GSM3448549', 'GSM3448523', 'GSM3448735', 'GSM3448499', 'GSM3448333', 'GSM3448319', 'GSM3448629', 'GSM3448416', 'GSM3448439', 'GSM3448734', 'GSM3448522', 'GSM3448711', 'GSM3448651', 'GSM3448605', 'GSM3448545', 'GSM3448628', 'GSM3448360', 'GSM3448466', 'GSM3448752', 'GSM3448463', 'GSM3448546', 'GSM3448569', 'GSM3448732', 'GSM3448652', 'GSM3448446', 'GSM3448357', 'GSM3448440', 'GSM3448758', 'GSM3448675', 'GSM3448778', 'GSM3448755', 'GSM3448672', 'GSM3448649', 'GSM3448339', 'GSM3448399', 'GSM3448422', 'GSM3448359', 'GSM3448505', 'GSM3448731', 'GSM3448276', 'GSM3448479', 'GSM3448708', 'GSM3448562', 'GSM3448293', 'GSM3448625', 'GSM3448316', 'GSM3448774', 'GSM3448751', 'GSM3448668', 'GSM3448645', 'GSM3448465', 'GSM3448691', 'GSM3448568', 'GSM3448585', 'GSM3448654', 'GSM3448356', 'GSM3448688', 'GSM3448462', 'GSM3448322', 'GSM3448345', 'GSM3448273', 'GSM3448428', 'GSM3448451', 'GSM3448534', 'GSM3448737', 'GSM3448296', 'GSM3448379', 'GSM3448368', 'GSM3448760', 'GSM3448402', 'GSM3448531', 'GSM3448771', 'GSM3448365', 'GSM3448448', 'GSM3448485', 'GSM3448471', 'GSM3448637', 'GSM3448554', 'GSM3448425', 'GSM3448577', 'GSM3448757', 'GSM3448342', 'GSM3448743', 'GSM3448777', 'GSM3448660', 'GSM3448754', 'GSM3448763', 'GSM3448694', 'GSM3448740', 'GSM3448680', 'GSM3448657', 'GSM3448634', 'GSM3448551', 'GSM3448574', 'GSM3448445', 'GSM3448482', 'GSM3448588', 'GSM3448459', 'GSM3448542', 'GSM3448565', 'GSM3448671', 'GSM3448376', 'GSM3448648', 'GSM3448528', 'GSM3448325', 'GSM3448348', 'GSM3448611', 'GSM3448299', 'GSM3448405', 'GSM3448382', 'GSM3448511', 'GSM3448617', 'GSM3448305', 'GSM3448285', 'GSM3448783', 'GSM3448508', 'GSM3448488', 'GSM3448591', 'GSM3448700', 'GSM3448571', 'GSM3448677', 'GSM3448594', 'GSM3448720', 'GSM3448388', 'GSM3448697', 'GSM3448614', 'GSM3448780', 'GSM3448674', 'GSM3448282', 'GSM3448717', 'GSM3448431', 'GSM3448514', 'GSM3448491', 'GSM3448597', 'GSM3448302', 'GSM3448408', 'GSM3448279', 'GSM3448362', 'GSM3448385', 'GSM3448468']",['Homo sapiens'],"['Expression profiling by high throughput sequencing', 'Non-coding RNA profiling by high throughput sequencing']"
18,'GEO',"['GSE88888', 'SRP091714']",u'A monocyte gene expression signature in the early clinical course of Parkinson\u2019s disease',"u'Recent studies suggest that the activation of the innate immune system is an integral part of Parkinson\u2019s disease (PD) pathology. Monocytes have a critical role as effectors and regulators of the innate immune system, and a recent expression quantitative trait locus (eQTL) study links monocytes to PD. Patients diagnosed with PD according to the National Institute of Neurological Disorders and Stroke diagnostic criteria for PD were included. We applied a standardized procedure with blood drawing from fasting participants. PD patients with Hoehn and Yahr > 2 and/or cognitive impairment were not recruited. Participants with a history of cancer, infectious diseases within the past three months, or taking anti-inflammatory drugs were excluded. Altogether, we analyzed the monocytic transcriptome profiles of 10 PD patients and 9 age- and sex-matched controls using mRNA sequencing.'",[30018301],"[""A monocyte gene expression signature in the early clinical course of Parkinson's disease.""]",['2018 Jul 17'],"[['Schlachetzki JCM', 'Prots I', 'Tao J', 'Chun HB', 'Saijo K', 'Gosselin D', 'Winner B', 'Glass CK', 'Winkler J']]",['GPL11154'],['Illumina HiSeq 2000 (Homo sapiens)'],"[('GSM2350784', 'SRX2250661'), ('GSM3501959', 'SRX5096296'), ('GSM2350781', 'SRX2250658'), ('GSM2350787', 'SRX2250664'), ('GSM2350793', 'SRX2250670'), ('GSM2350790', 'SRX2250667'), ('GSM2350786', 'SRX2250663'), ('GSM2350789', 'SRX2250666'), ('GSM2350792', 'SRX2250669'), ('GSM2350795', 'SRX2250672'), ('GSM2350791', 'SRX2250668'), ('GSM2350794', 'SRX2250671'), ('GSM2350797', 'SRX2250674'), ('GSM2350783', 'SRX2250660'), ('GSM3501958', 'SRX5096295'), ('GSM2350780', 'SRX2250657'), ('GSM2350779', 'SRX2250656'), ('GSM2350796', 'SRX2250673'), ('GSM2350788', 'SRX2250665'), ('GSM3501957', 'SRX5096294')]",['Homo sapiens'],['Expression profiling by high throughput sequencing']
19,'GEO',['GSE114897'],'Real-time quantitative PCR analysis of human stroke patients recovering from upper extremity hemiparesis',"'Fasting blood samples were collected from 27 stroke patients in EDTA tubes mean 19 days post-stroke, plasma was extracted and frozen at -80C, then 200uL of plasma sent for qPCR.'",[30135469],['Plasma microRNA markers of upper limb recovery following human stroke.'],['2018 Aug 22'],"[['Edwardson MA', 'Zhong X', 'Fiandaca MS', 'Federoff HJ', 'Cheema AK', 'Dromerick AW']]",['GPL18942'],['Applied Biosystems Taqman Low Density Array Human microRNA Card A+B Set v3.0'],"['GSM3154169', 'GSM3154172', 'GSM3154166', 'GSM3154186', 'GSM3154163', 'GSM3154180', 'GSM3154183', 'GSM3154160', 'GSM3154164', 'GSM3154167', 'GSM3154161', 'GSM3154181', 'GSM3154184', 'GSM3154178', 'GSM3154175', 'GSM3154176', 'GSM3154182', 'GSM3154162', 'GSM3154173', 'GSM3154179', 'GSM3154170', 'GSM3154177', 'GSM3154171', 'GSM3154174', 'GSM3154168', 'GSM3154185', 'GSM3154165']",['Homo sapiens'],['Expression profiling by RT-PCR']
20,'GEO',['GSE102106'],"'Gene Expression of Primary Human Type I Alveolar Epithelial Cells Exposed to Bacillus anthracis, Sterne endospores'","u'The lung is the entry site for Bacillus anthracis in inhalation anthrax, the most deadly form of the disease. Spores must escape through the alveolar epithelial cell (AEC) barrier and migrate to regional lymph nodes, germinate and enter the circulatory system to cause disease. Several mechanisms to explain alveolar escape have been postulated, and all these tacitly involve the AEC barrier. In this study, we incorporate our primary human type I AEC model, microarray gene profiling and gene enrichment analysis to study the response of AEC to B. anthracis, (Sterne) spores at 4 and 24 hours post-exposure. Spore exposure altered gene expression in AEC after 4 and 24 hours and differentially expressed genes (\xb11.3 fold, p \u2264 0.05) included CCL4/MIP-1\u03b2 (4 hours), CXCL8/IL-8 (4 and 24 hours) and CXCL5/ENA-78 (24 hours). Gene enrichment analysis revealed that pathways involving cytokine or chemokine activity, receptor binding, and innate immune responses to infection were prominent. Microarray results were confirmed by qRT-PCR and multiplex ELISA assays. Chemotaxis assays demonstrated that spores induced the release of biologically active neutrophil and monocyte chemokines, and that CXCL8/IL-8 was the major neutrophil chemokine. The small or sub-chemotactic doses of CXCL5/ENA-78, CXCL3/GRO\u03b2\u03b2 and CCL20/MIP-3\u03b1 may contribute to chemotaxis by priming effects. These data provide the first whole transcriptomic description of the human type I AEC initial response to B. anthracis spore exposure, and contribute to an increased understanding of the role of AEC in the pathogenesis of inhalational anthrax. We used microarrays to create a whole transcriptomic description of the response of primary human type I alveolar epithelial cells to B. anthracis spore exposure and demonstrated that several of the most upregulated differentially expressed genes included those for neutrophil and monocyte chemokines.'",[29704667],['Gene expression profiling of primary human type I alveolar epithelial cells exposed to Bacillus anthracis spores reveals induction of neutrophil and monocyte chemokines.'],['2018 Aug'],"[['Booth JL', 'Duggan ES', 'Patel VI', 'Wu W', 'Burian DM', 'Hutchings DC', 'White VL', 'Coggeshall KM', 'Dozmorov MG', 'Metcalf JP']]",['GPL16686'],['[HuGene-2_0-st] Affymetrix Human Gene 2.0 ST Array [transcript (gene) version]'],"['GSM2723967', 'GSM2723970', 'GSM2723964', 'GSM2723973', 'GSM2723965', 'GSM2723968', 'GSM2723971', 'GSM2723966', 'GSM2723974', 'GSM2723969', 'GSM2723972', 'GSM2723975']",['Homo sapiens'],['Expression profiling by array']
21,'GEO',['GSE113013'],'Comparison of atrial appendage tissues of patients with Valvular Heart Disease and patients with Valvular Heart Disease-Atrial Fibrillation',"'Atrial fibrillation (AF) is the most common heart arrhythmia disease. The greatest risk of atrial fibrillation is stroke, and stroke caused by valvular heart disease with atrial fibrillation (AF-VHD) is more serious. the development mechanism from VHD to AF-VHD is not yet clear. The research on expression profiles of lncRNA and mRNA is helpful to explore molecular mechanism in patients with valvular heart disease who develop atrial fibrillation.'",[],[],[],[],['GPL16956'],['Agilent-045997 Arraystar human lncRNA microarray V3 (Probe Name Version)'],"['GSM3093575', 'GSM3093572', 'GSM3093569', 'GSM3093570', 'GSM3093576', 'GSM3093573', 'GSM3093571', 'GSM3093568', 'GSM3093574', 'GSM3093577']",['Homo sapiens'],"['Expression profiling by array', 'Non-coding RNA profiling by array']"
22,'GEO',['GSE109233'],"'No-glucose, hypoxic or ischemic (ODG) treatment of pericytes'","'Brain pericytes are important to maintain vascular integrity of the neurovascular unit under both, physiological and ischemic conditions. Ischemic stroke is known to induce an inflammatory and hypoxic response due to the lack of oxygen and glucose in the brain tissue. How this early response to ischemia is molecularly regulated in pericytes is largely unknown but may be of importance for future therapeutic targets .Here we evaluate the transcriptional responses in in vitro cultured human brain pericytes after oxygen and/or glucose deprivation. Hypoxia has been widely known to stabilise the transcription factor hypoxia inducible factor 1-alpha (HIF1alpha) and mediate the induction of hypoxic transcriptional programs after ischemia. However, we find that the transcription factors Jun Proto-Oncogene (c-JUN), Nuclear Factor Of Kappa Light Polypeptide Gene Enhancer In B-Cells (NFkappaB) and signal transducer and activator of transcription 3 (STAT3) bind genes regulated after 2 hours of omitted glucose and oxygen before HIF1alpha. Potent HIF1alpha responses require 6 hours of hypoxia to substantiate transcriptional regulation comparable to either c-JUN or STAT3. We show that STAT3 and c-JUN are regulating their bound genes before HIF1alpha after 2 hours of hypoxia or omitted glucose and oxygen, suggesting that HIF1alpha is not the initiating trans-acting factor in the response of pericytes to ischemia.'",[29518129],[u'STAT3 precedes HIF1\u03b1 transcriptional responses to oxygen and oxygen and glucose deprivation in human brain pericytes.'],['2018'],"[['Carlsson R', u'\xd6zen I', 'Barbariga M', 'Gaceb A', 'Roth M', 'Paul G']]",['GPL10558'],['Illumina HumanHT-12 V4.0 expression beadchip'],"['GSM2935659', 'GSM2935682', 'GSM2935679', 'GSM2935662', 'GSM2935673', 'GSM2935656', 'GSM2935676', 'GSM2935657', 'GSM2935674', 'GSM2935680', 'GSM2935677', 'GSM2935665', 'GSM2935671', 'GSM2935669', 'GSM2935668', 'GSM2935675', 'GSM2935672', 'GSM2935660', 'GSM2935666', 'GSM2935663', 'GSM2935670', 'GSM2935664', 'GSM2935667', 'GSM2935655', 'GSM2935678', 'GSM2935661', 'GSM2935658', 'GSM2935681']",['Homo sapiens'],['Expression profiling by array']
23,'GEO',"['GSE106520', 'SRP123611']",'RNA-seq in neutrophils from patients with intracranial aneurysms',"'In this study, we explored transcriptional differences in human neutrophils from patients with intracranial aneurysms and a demographic and comorbidity paired population of controls'","[29342213, 31666072]","['Circulating neutrophil transcriptome may reveal intracranial aneurysm signature.', 'Epigenetic landscapes suggest that genetic risk for intracranial aneurysm operates on the endothelium.']","['2018', '2019 Oct 30']","[['Tutino VM', 'Poppenberg KE', 'Jiang K', 'Jarvis JN', 'Sun Y', 'Sonig A', 'Siddiqui AH', 'Snyder KV', 'Levy EI', 'Kolega J', 'Meng H'], ['Poppenberg KE', 'Jiang K', 'Tso MK', 'Snyder KV', 'Siddiqui AH', 'Kolega J', 'Jarvis JN', 'Meng H', 'Tutino VM']]",['GPL16791'],['Illumina HiSeq 2500 (Homo sapiens)'],"[('GSM2839736', 'SRX3361945'), ('GSM2839739', 'SRX3361948'), ('GSM2839733', 'SRX3361942'), ('GSM2839745', 'SRX3361954'), ('GSM2839722', 'SRX3361931'), ('GSM2839742', 'SRX3361951'), ('GSM2839725', 'SRX3361934'), ('GSM2839751', 'SRX3361960'), ('GSM2839728', 'SRX3361937'), ('GSM2839731', 'SRX3361940'), ('GSM2839734', 'SRX3361943'), ('GSM2839748', 'SRX3361957'), ('GSM2839740', 'SRX3361949'), ('GSM2839737', 'SRX3361946'), ('GSM2839723', 'SRX3361932'), ('GSM2839749', 'SRX3361958'), ('GSM2839726', 'SRX3361935'), ('GSM2839746', 'SRX3361955'), ('GSM2839729', 'SRX3361938'), ('GSM2839743', 'SRX3361952'), ('GSM2839732', 'SRX3361941'), ('GSM2839752', 'SRX3361961'), ('GSM2839735', 'SRX3361944'), ('GSM2839724', 'SRX3361933'), ('GSM2839741', 'SRX3361950'), ('GSM2839727', 'SRX3361936'), ('GSM2839730', 'SRX3361939'), ('GSM2839744', 'SRX3361953'), ('GSM2839721', 'SRX3361930'), ('GSM2839738', 'SRX3361947'), ('GSM2839750', 'SRX3361959'), ('GSM2839747', 'SRX3361956')]",['Homo sapiens'],['Expression profiling by high throughput sequencing']
24,'GEO',['GSE96621'],'Comparison miRNA expression between atherosclerotic and non-atherosclerotic ischemic stroke patients','The difference of circulating miRNA expressions by the presence of atherosclerosis in intra- and extra-cranial vessels were evaluated using serum of ischemic stroke patients.',[28557988],['Synergy of circulating miR-212 with markers for cardiovascular risks to enhance estimation of atherosclerosis presence.'],['2017'],"[['Jeong HS', 'Kim JY', 'Lee SH', 'Hwang J', 'Shin JW', 'Song KS', 'Lee S', 'Kim J']]",['GPL18942'],['Applied Biosystems Taqman Low Density Array Human microRNA Card A+B Set v3.0'],"['GSM2536692', 'GSM2536695', 'GSM2536698', 'GSM2536691', 'GSM2536694', 'GSM2536697', 'GSM2536700', 'GSM2536703', 'GSM2536696', 'GSM2536699', 'GSM2536701', 'GSM2536705', 'GSM2536704', 'GSM2536702', 'GSM2536693']",['Homo sapiens'],['Expression profiling by RT-PCR']
25,'GEO',"['GSE77784', 'SRP069864']",'MOF acetyl transferase regulates transcription and respiration in mitochondria',"'Histone acetylation is sensitive to metabolic cues, however interplay between histone acetyl transferases and cellular metabolism remains poorly understood. Here we report the localization of a classical nuclear HAT- MOF and members of Non-Specific Lethal complex in mitochondria. MOF regulates expression of oxidative phosphorylation (OXPHOS) genes, residing in both nuclear and mitochondrial genomes, selectively in aerobically respiring cells. Furthermore, MOF/KANSL1 depletion causes impaired mitochondrial translation and reduced respiration. MOF loss is catastrophic for tissues with high-energy consumption. In mouse hearts, Mof knockout causes hypertrophic cardiomyopathy, compromised ventricular contractility/ stroke volume and ultimately leads to cardiac failure within three weeks of birth. RNA-seq analysis of the cardiomyocytes revealed deregulation of mitochondrial nutrient metabolism and OXPHOS pathways. Consistently, electron microscopy on affected tissues revealed mitochondrial deterioration with high tissue heterogeneity, commonly observed in mitochondrial diseases. Thus, we reveal a novel function of MOF in mitochondrial homeostasis and propose MOF as a sensor connecting epigenetic regulation to metabolism.'",[27768893],['MOF Acetyl Transferase Regulates Transcription and Respiration in Mitochondria.'],['2016 Oct 20'],"[['Chatterjee A', 'Seyfferth J', 'Lucci J', 'Gilsbach R', 'Preissl S', u'B\xf6ttinger L', u'M\xe5rtensson CU', 'Panhale A', 'Stehle T', 'Kretz O', 'Sahyoun AH', 'Avilov S', 'Eimer S', 'Hein L', 'Pfanner N', 'Becker T', 'Akhtar A']]","['GPL17021', 'GPL16791']","['Illumina HiSeq 2500 (Mus musculus)', 'Illumina HiSeq 2500 (Homo sapiens)']","[('GSM2059223', 'SRX1569993'), ('GSM2059226', 'SRX1569996'), ('GSM2059220', 'SRX1569990'), ('GSM2059217', 'SRX1569987'), ('GSM2059221', 'SRX1569991'), ('GSM2059218', 'SRX1569988'), ('GSM2059235', 'SRX1570005'), ('GSM2059229', 'SRX1569999'), ('GSM2059232', 'SRX1570002'), ('GSM2059233', 'SRX1570003'), ('GSM2059230', 'SRX1570000'), ('GSM2059224', 'SRX1569994'), ('GSM2059227', 'SRX1569997'), ('GSM2059234', 'SRX1570004'), ('GSM2059228', 'SRX1569998'), ('GSM2059231', 'SRX1570001'), ('GSM2059225', 'SRX1569995'), ('GSM2059219', 'SRX1569989'), ('GSM2059222', 'SRX1569992')]","['Mus musculus', 'Homo sapiens']",['Expression profiling by high throughput sequencing']
